State | City | Name | Description
MASSACHUSETTS | SPRINGFIELD | MRS. J. A. RUMRILL. | From her father, Chester W. Chapin. Made in the Boston and Albany Railroad, the Union Pacific Railroad, and other railroad, canal and steamboat enterprises.
MASSACHUSETTS | TAUNTON | WILLIAM MASON. | Building locomotives and other machinery ; real estate in Boston. etc. There are $650,000 of real estate in Boston (Mason Machine Works).
MASSACHUSETTS | WHITINSVILLE | JAMES F. WHITIN. | Manufacturing cotton and machine shops.
MASSACHUSETTS | WEBSTER | HORATIO SLATER. | Manufacturing woollens and investments.
MASSACHUSETTS | WORCESTER | STEPHEN SALISBURY. | Inherited from his father, of the same name. Made in banking, railroads and real estate. President of Worcester National Bank.
MASSACHUSETTS | WORCESTER | JONAS G. CLARK. | Sale of furniture in California, and real estate investments.
MASSACHUSETTS | WORCESTER | GEORGE S. BARTON. | Iron manufacturing.
MASSACHUSETTS | WORCESTER | GEORGE HENRY WHITCOMB. | Inherited from his father, David Whitcomb, who made his fortune in retailing hardware and then became a manufacturer of envelopes. Increased by investments in real estate, East and West.
MASSACHUSETTS | WORCESTER | WILLIAM GILES. | Law, railroads and investments. He left $2,000,000.
MASSACHUSETTS | WORCESTER | ICHABOD WASHBURN. | Made in the manufacture of barbed wire, by inventions and processes, for the use of which the Washburn & Moen Manufacturing Company are still paid royalties by concerns all over the country.
MASSACHUSETTS | WORCESTER | JOSEPH H. WALKER. | Tanning and the manufacture of boots and shoes.
MASSACHUSETTS | WORCESTER | EDWARD L. DAVIS. | Inherited. Made in car-wheel manufacturing.
MASSACHUSETTS | WORCESTER | WILLIAM B. RICE. | Manufacturing wire.
MASSACHUSETTS | WORCESTER | JESSE MOORE. | Distilling in Kentucky.
MASSACHUSETTS | WORCESTER | R. C. TAYLOR. | Real estate and kindred investments.
MASSACHUSETTS | WORCESTER | PHILIP L. MOEN. | Manufacturing barbed wire and patented implements.
MASSACHUSETTS | WORCESTER | F. B. KNOWLES. | Manufacturing patented looms.
MASSACHUSETTS | WALTHAM | THEOPHILUS WALKER. | Manufacturing glue and also interested in the Danvers Bleachery and Dye Works. He left an estate of $3,000,000.
MICHIGAN | CITY OF ALPENA | FRANK W. GILCHRIST. | Pine lands and lake vessels.
MICHIGAN | CITY OF ALPENA | GEORGE N. FLETCHER. | Pine lands, saw mills, real estate and sulphite factory.
MICHIGAN | CITY OF ALPENA | A. W. COMSTOCK. | Pine lands and saw mills. President of Alpena Banking Company.
MICHIGAN | CITY OF ALPENA | A. N. SPRATT. | Pine lands, saw mills, mining land in Montana, etc.
MICHIGAN | CITY OF ALPENA | MRS. DIANA RICHARDSON. | Pine lands and sale of stumpage. From her late husband.
MICHIGAN | CITY OF ALPENA | HENRY BOLTON (of Bolton & McRae). | Wholesale general merchandise, cedar trees, telegraph poles, etc.
MICHIGAN | CITY OF ALPENA | DONALD McRAE (of Bolton & McRae). | General merchandise, cedar trees, telegraph poles, etc.
MICHIGAN | CITY OF ALPENA | W. B. COMSTOCK. | Pine lands, sale of stumpage, and banking.
MICHIGAN | ALMA | A. W. WRIGHT (of the A. W. Wright Lumber Company). | Saw mills, lumber, pine lands, banking and railroads.
MICHIGAN | BAY CITY | N. B. BRADLEY. | Sawmills; manufacture of lumber; and pine lands.
MICHIGAN | BAY CITY | F. P. CHESBROUGH (of Chesebrough & Charlton). | Pine lands, manufacturing lumber, and investments.
MICHIGAN | BAY CITY | ALEXANDER FOLSOM (of Folsom & Arnold). | Lumber; saw mills, pine lands; and banking.
MICHIGAN | CHEBOYGAN | THOMPSON SMITH. | Lumber, manufacturing, pine lands and vessels.
MICHIGAN | DETROIT | GEN. R. A. ALGER. | Pine lands, manufacturing, lumber and investments. Director in the United States Express Company.
MICHIGAN | DETROIT | NEWELL AVERY. | Manufacturing, lumber and pine lands.
MICHIGAN | DETROIT | E. ALFRED BRUSH. | Inherited a large fortune from his father, who made the money in real estate in Detroit.
MICHIGAN | DETROIT | LUTHER BEECHER. | Railroads, mines and real estate.
MICHIGAN | DETROIT | CHRISTIAN H. BUHL (of Buhl, Sons & Co.). | Wholesale hardware and tinware; manufacturing iron and investments; president of Detroit National Bank.
MICHIGAN | DETROIT | C. C. BOWEN (of D. M. Ferry & Co.). | Raising and dealing in seeds, and investments.
MICHIGAN | DETROIT | MRS. DR. BOOK. | Inherited several millions from her father, Francis Palms, sr., who made his fortune in dealing in mineral and pine lands, sale of stumpage, banking, etc.
MICHIGAN | DETROIT | JOHN J. BAGLEY. | Manufacturing tobacco and real estate.
MICHIGAN | DETROIT | WM. A. BUTLER. | President of Mechanics’ Bank, city real estate.
MICHIGAN | DETROIT | THEO. H. EATON. | Wholesale drugs, chemicals, etc.
MICHIGAN | DETROIT | D. M. FERRY (of D. M. Ferry & Co.). | Raising and dealing in seeds, banking, real estate, etc.
MICHIGAN | DETROIT | JACOB S. FARRAND (of the former firm of Farrand, Williams & Co.). | Wholesale drugs, paints and oils; banking and real estate.
MICHIGAN | DETROIT | PETER HENKEL. | Wholesale liquors and groceries.
MICHIGAN | DETROIT | GEORGE H. HAMMOND. | Pork packing and real estate.
MICHIGAN | DETROIT | COL. F. J. HECKER, president of the Peninsular Car Company. | Made in building railroad cars.
MICHIGAN | DETROIT | BELA HUBBARD. | Real estate investments.
MICHIGAN | DETROIT | GEORGE HENRIE. | City railroads, banking, contracting, etc.
MICHIGAN | DETROIT | JAMES F. JOY, formerly president of the Michigan Central Railroad. | Made in railroads and investments.
MICHIGAN | DETROIT | EDWARD KANTER. | Banking and real estate. President of German-American Bank.
MICHIGAN | DETROIT | G. V. N. LOTHROP. | Law practice, investments in real estate, etc.
MICHIGAN | DETROIT | WILLIAM B. MORAN. | Real estate, inherited in part.
MICHIGAN | DETROIT | W. K. MUIR. | Street railroads and real estate.
MICHIGAN | DETROIT | JAMES McMILLAN. | He is at the head of fifteen or twenty companies and factories. Made his fortune in railroads, car building, and manufacturing.
MICHIGAN | DETROIT | HUGH McMILLAN. | President of Commercial National Bank. Made his fortune in railroads, car building and manufacturing.
MICHIGAN | DETROIT | S. J. MURPHY. | Pine lands, sawmills and lumber.
MICHIGAN | DETROIT | JOHN S. NEWBERRY. | Car building, railroads, banking and real estate.
MICHIGAN | DETROIT | FRANCIS PALMS. | Inherited from his father. Money made in dealing in pine and mineral lands, banking, etc.
MICHIGAN | DETROIT | T. W. PALMER. | Dealing in pine lands, real estate and banking. Partly by gift. All made in the same way.
MICHIGAN | DETROIT | MRS. T. W. PALMER (born Merrill). | From her father. Made in dealing in pine lands, etc.
MICHIGAN | DETROIT | WILLIAM H. STEVENS. | Banking and stock farm. President of Third National Bank and of American Banking and Savings Association.
MICHIGAN | DETROIT | M. S. SMITH. | Jewelry, lumber manufacturing and pine lands.
MICHIGAN | DETROIT | DANIEL SCOTTEN. | Tobacco manufacturing.
MICHIGAN | DETROIT | ALLAN SHELDON. | Wholesale dry goods, real estate, banking, etc.
MICHIGAN | DETROIT | TRANGOTT SCHMIDT. | Tanning and leather, dealing in wool, furs, etc.
MICHIGAN | DETROIT | ALANSON SHELEY (of Williams, Davis, Brooks & Co.). | Wholesale drugs, paints and oil, real estate, banking, etc.
MICHIGAN | DETROIT | MISS LILLIE THOMPSON. | Inherited from her grandfather, Brush. Made in real estate in Detroit.
MICHIGAN | DETROIT | E. W. VOIGHT. | Brewing, real estate and investments.
MICHIGAN | DETROIT | WILLIAM B. WESSON. | Real estate and banking. Was president of a savings bank and Trust, Security and Safe Deposit company.
MICHIGAN | DETROIT | DAVID WHITNEY, Jr. | Reputed to be the richest man in Michigan. Fortune made in saw mills, lumber, vessels on the lakes, banking, Detroit real estate, etc.
MICHIGAN | DETROIT | HIRAM WALKER. | Distilling.
MICHIGAN | DETROIT | DAVID WARD. | Dealing in lumber and in pine and mineral lands, silver mines in Utah and investments.
MICHIGAN | DETROIT | W. C. YAWKEY. | Dealing in lumber and pine lands.
MICHIGAN | FLINT | ALEXANDER McFARLAN. | Manufacturing lumber and pine lands.
MICHIGAN | GRAND HAVEN | DWIGHT CUTLER. | Saw mills, lumber, dealing in real estate, etc. President of Cutler & Savidge, lumber manufacturers. President of First National Bank.
MICHIGAN | GRAND RAPIDS | J. W. CONVERSE. | Manufacturing lumber and in the O. E. Brown Flour Milling Company.
MICHIGAN | GRAND RAPIDS | DANIEL H. WATERS. | Real estate, pine lands, etc.
MICHIGAN | GRAND RAPIDS | D. A. BLODGETT. | Lumber, saw mills and private bank at Cadillac.
MICHIGAN | JACKSON | H. A. HAYDEN. | Milling, real estate and banking.
MICHIGAN | JACKSON | WILEY R. REYNOLDS. | Milling, banking and real estate.
MICHIGAN | JACKSON | WILLIAM D. THOMPSON. | Manufacturing interests and president of Jackson City Bank.
MICHIGAN | LUDINGTON | THOMAS R. LYON. | Sawmills, lumber, grocery-store, etc.
MICHIGAN | MARINE CITY | WILLIAM B. MORLEY. | Shipbuilding; vessel owning on the Lakes; freighting, etc.
MICHIGAN | MARQUETTE | JOHN M. LONGYEAR. | Dealing in pine lands, iron-ore lands, etc.
MICHIGAN | MARQUETTE | MRS. MARY BREITUNG. | From her husband, Edward Breitung. Made in dealing in iron-mining lands and pine lands.
MICHIGAN | MUSKEGON | CHARLES H. HACKLEY (of Hackley & Hume). | Sawmills and lumber; president of Muskegon National Bank.
MICHIGAN | MUSKEGON | T. D. STIMSON. | Manufacturing and selling lumber.
MICHIGAN | MUSKEGON | JOHN TORRENT. | Pine lands, sawmills, lumber, stoves, etc.
MICHIGAN | MUSKEGON | JONATHAN BOYCE. | Manufacturing, lumber and planing.
MICHIGAN | MENOMINEE | S. M. STEPHENSON. | Mines, dealing in lands, saw-mills and hotels; vice-president of The Kirby-Carpenter Co. and president of First National Bank.
MICHIGAN | MANISTIQUE | J. D. WESTON. | Sawmills; lumber; manufacturing sashes, doors, etc.
MICHIGAN | MANISTEE | CHARLES F. RUGGLES. | Pine lands, stumpage and sale of rough timber.
MICHIGAN | MANISTEE | JOHN CANFIELD (of the Canfield Salt and Lumber Company). | Manufacturing lumber and salt, and tug line on the lakes.
MICHIGAN | MANISTEE | E. G. FILER (of L. C. Filer & Sons). | Sawmill, pine lumber and grocery store.
MICHIGAN | MANISTEE | LOUIS SANDS. | Sawmill, pine lumber and grocery store.
MICHIGAN | MANISTEE | D. W. FILER (of D. L. Filer & Sons). | Lumber, saw-mill and grocery store.
MICHIGAN | MANISTEE | JAMES DEMPSEY. | Pine lands and manufacturing lumber.
MICHIGAN | MANISTEE | EDWARD BUCKLEY. | Pine lands and manufacturing lumber.
MICHIGAN | NILES | H. A. CHAPIN. | Owner of the famous Chapin iron mine, which he leases. He has also made money in real estate and loans.
MICHIGAN | SAGINAW | AMASA RUST (of Rust Bros. & Co.). | Sawmill; lumber and salt.
MICHIGAN | SAGINAW | W. R. BURT. | Dealing in pine lands, sawmills and lumber.
MICHIGAN | SAGINAW | DANIEL HARDIN. | Manufacturing salt, planing mill, pine lands, banking, etc., president of Commercial National Bank.
MICHIGAN | SAGINAW | EZRA RUST. | Sawmills, pine lands.
MICHIGAN | SAGINAW | ARTHUR HILL. | Dealing in timber and pine lands principally.
MICHIGAN | SAGINAW | THOMAS MERRILL. | Dealing in timber and pine lands principally.
MICHIGAN | SAGINAW | GEORGE L. BURROWS. | Private banking and pine lands. Inherited a large sum from his father.
MICHIGAN | SAINT JOHN’S | ROBERT M. STEEL. | Made in building railroads mainly (Union Pacific and Northern Pacific); also in banking, dealing in pine lands, and furniture manufacturing.
MICHIGAN | TRAVERSE CITY | PERRY HANNAH (of Hannah, Lay & Co.). | Manufacturing lumber; dealing in pine lands; banking; real estate, and hotel.
MINNESOTA | CITY OF DULUTH | JOSEPH SELLWOOD. | Made in iron mines and real estate.
MINNESOTA | CITY OF DULUTH | A. M. MILLER. | Started in a logging camp, and made money by real estate investments.
MINNESOTA | CITY OF DULUTH | JOHN D. HOWARD. | Originally a grocery store at Superior. Then investing in real estate in Superior and Duluth.
MINNESOTA | CITY OF DULUTH | LUTHER MENDENHALL. | Banking and real estate. President of Duluth Union National Bank.
MINNESOTA | MANKATO | JOHN A. WILLARD. | Law practice and real estate chiefly. He made his first money in Winnebago Reservation lands and next in Sioux lands on the Minnesota River. At one time he owned about 12,000 acres in Blue Earth County, and 19,000 acres acres in Yellow Medicine, Redwood and Brown counties, Minnesota. In 1873 with R. D. Hubbard and another partner, he built the linseed oil mill here, and made some money therein. Since 1878 he has been president of the First National Bank. Also interested in a brick yard, the Mankato Knitting Works, and the Standard Fibreware Co.
MINNESOTA | MANKATO | R. D. HUBBARD (of Hubbard & Gere, oil millers and R. D. Hubbard & Co., flour millers). | Made his money in oil and flour milling; cattle raising in Montana; real estate, in Duluth and Chicago, etc. Director and owner in the First National Bank.
MINNESOTA | MINNEAPOLIS | H. W. BROWN. | Gasworks and local enterprises.
MINNESOTA | MINNEAPOLIS | H. C. AKELEY. | Manufacturing lumber.
MINNESOTA | MINNEAPOLIS | JOSEPH DEAN. | Lumber business, loans and mortgages.
MINNESOTA | MINNEAPOLIS | L. F. MENAGE. | Rise in real estate and loans.
MINNESOTA | MINNEAPOLIS | THOMAS LOWRY. | Real estate and street railways.
MINNESOTA | MINNEAPOLIS | P. G. WINSTON. | Railroad contracting.
MINNESOTA | MINNEAPOLIS | F. G. WINSTON. | Railroad contracting.
MINNESOTA | MINNEAPOLIS | T. B. WALKER. | Pine lands, sawmills, lumber and banking. President of Flour City National Bank.
MINNESOTA | MINNEAPOLIS | JOHN C. OSWALD. | The sale of liquors, wholesale, and investments.
MINNESOTA | MINNEAPOLIS | L. M. STEWART. | Law practice for many years and investments.
MINNESOTA | MINNEAPOLIS | H. F. BROWN. | Sawmills and lumber.
MINNESOTA | MINNEAPOLIS | C. G. GOODRICH. | Street railroads and rise in the value of inherited real estate.
MINNESOTA | MINNEAPOLIS | S. G. COOK. | Lumber manufacturing.
MINNESOTA | MINNEAPOLIS | J. H. THOMPSON. | Made in the sale of clothing.
MINNESOTA | MINNEAPOLIS | S. T. McKNIGHT. | Sawmills and lumber.
MINNESOTA | MINNEAPOLIS | JOHN MARTIN. | Sawmills and lumber.
MINNESOTA | MINNEAPOLIS | A. J. SAWYER. | Made in the grain business.
MINNESOTA | MINNEAPOLIS | GEORGE H. CHRISTIAN. | Flour milling.
MINNESOTA | MINNEAPOLIS | W. S. BENTON. | Linseed oil manufacturing.
MINNESOTA | MINNEAPOLIS | J. B. GILFILLAN. | Real estate investments.
MINNESOTA | MINNEAPOLIS | J. W. JOHNSON. | Iron manufacturing.
MINNESOTA | MINNEAPOLIS | W. H. DUNWOODY. | Flour milling and dealing in grain.
MINNESOTA | MINNEAPOLIS | C. H. PRIOR. | Real estate investments.
MINNESOTA | MINNEAPOLIS | H. T. WELLES. | Investments in local real estate.
MINNESOTA | MINNEAPOLIS | F. H. PEAVEY. | Dealing in grain.
MINNESOTA | MINNEAPOLIS | W. W. EASTMAN. | Manufacturing, real estate and loans.
MINNESOTA | MINNEAPOLIS | H. G. SIDLE. | Made in real estate and banking.
MINNESOTA | MINNEAPOLIS | C. C. WASHBURN. | Flour milling.
MINNESOTA | MINNEAPOLIS | GEORGE R. NEWELL. | Wholesale groceries.
MINNESOTA | MINNEAPOLIS | LEVI L. COOK. | Made by the advance in values of real estate.
MINNESOTA | MINNEAPOLIS | D. MORRISON. | Made a large fortune in pine lands and their advance in value; and manufacturing.
MINNESOTA | MINNEAPOLIS | CLINTON MORRISON. | Presented with a fortune made by his father, D. Morrison, in pine lands and manufacturing, which has been added to by himself by investments in real estate, etc. President of the Farmers and Mechanics’ Savings Bank.
MINNESOTA | MINNEAPOLIS | WILLIAM McNAIR. | Law practice and real estate.
MINNESOTA | MINNEAPOLIS | J. W. PENCE. | Made $400,000 by investment in whiskey just before the Government tax was put on in war times; and increased his fortune by purchases of real estate which has risen in value, and investments in mines.
MINNESOTA | MINNEAPOLIS | JOHN S. PILLSBURY. | Made in milling flour.
MINNESOTA | MINNEAPOLIS | GEORGE A. PILLSBURY. | Flour milling.
MINNESOTA | MINNEAPOLIS | CHARLES A. PILLSBURY. | Flour milling.
MINNESOTA | MINNEAPOLIS | SAMUEL C. GALE. | Rise in real estate; loans and insurance business.
MINNESOTA | MINNEAPOLIS | R. B. LANGDON. | Made in contracting and railroad building.
MINNESOTA | MINNEAPOLIS | T. B. CASEY. | Made in the sale of drygoods and banking.
MINNESOTA | MINNEAPOLIS | PETER WOLFORD. | Real estate investments and loans, the latter being his principal business.
MINNESOTA | MINNEAPOLIS | A. H. LINTON. | Railway contracting and building.
MINNESOTA | MINNEAPOLIS | RICHARD CHUTE. | Real estate and investments.
MINNESOTA | MINNEAPOLIS | H. E. FLETCHER. | Inheritance and real estate chiefly, but has also made money in milling.
MINNESOTA | ROCHESTER | GEORGE W. VAN DUSEN. | Buying grain extensively from farmers and shipping it; also engaged in the grain elevator business.
MINNESOTA | RED WING | JAMES LAWTHER. | Dealing in coal, and insurance business.
MINNESOTA | ST. CLOUD | N. P. CLARKE. | Logging and private banking.
MINNESOTA | ST. PAUL | FREDERICK WEYERHAUSER. | The bulk of his fortune made in pine lands. Some in manufacturing lumber.
MINNESOTA | ST. PAUL | R. C. JEFFERSON. | Sawmills, lumber and pine lands.
MINNESOTA | ST. PAUL | H. P. UPHAM. | Banking and dealings in railroad securities.
MINNESOTA | ST. PAUL | JAMES J. HILL. | Probably the richest man of the Northwest. Made entirely in railroads. President of the Great Northern Railway, and of the St. Paul, Minneapolis and Manitoba Railway. Is largely interested in other roads. Has absolute control of 4,000 miles of road, and is now building 800 miles to the Pacific coast.
MINNESOTA | ST. PAUL | MRS. JAMES J. HILL. | She received an anniversary present of a million dollars in Government bonds from her husband. Made in railroads.
MINNESOTA | ST. PAUL | NORMAN T. KITSON. | He left a fortune of $4,500,000, accumulated in steamboating, railroads and real estate.
MINNESOTA | ST. PAUL | WILLIAM DAWSON. | Made his money almost entirely in real estate. President of Bank of Minnesota.
MINNESOTA | ST. PAUL | CRAWFORD LIVINGSTON. | Made in gas and electric light business.
MINNESOTA | ST. PAUL | D. C. SHEPARD (of Griggs, Cooper & Co.). | Merchandising, groceries and railroad contracting.
MINNESOTA | ST. PAUL | PETER SIEMS. | Railroad contracting and building.
MINNESOTA | ST. PAUL | DENNIS RYAN. | Money made in selling silver and other mining properties.
MINNESOTA | ST. PAUL | A. H. WILDER. | Made his money in Government contracts, and increased it in ranches and real estate.
MINNESOTA | ST. PAUL | C. W. GRIGGS (of Griggs, Cooper & Co.). | Merchandising, groceries and lumber, and real estate investments.
MINNESOTA | ST. PAUL | ANSEL OPPENHEIM. | Made in railroads and real estate.
MINNESOTA | ST. PAUL | A. B. STICKNEY. | Made in railroads.
MINNESOTA | ST. PAUL | SAMUEL MAYALL. | Obtained his footing by Government contracts for supplies, and increased his fortune by investments in real estate.
MINNESOTA | ST. PAUL | W. R. MERRIAM. | Contracts and banking. President of Merchants’ National Bank.
MINNESOTA | ST. PAUL | P. H. KELLY. | Made in the grocery business and real estate.
MINNESOTA | ST. PAUL | C. D. GILFILLAN. | Made in the city waterworks and in banking.
MINNESOTA | ST. PAUL | E. F. DRAKE. | Made some money in law and in banking in Xenia, Ohio. Then embarked in railroad building in Minnesota, and brought to the State, the first rails, cars, and locomotives ever seen there. He built the St. Paul and St. Anthony road, and became largely interested in the St. Paul and Sioux City Railroad, of which he became the president. He was also interested in lumbering in Wisconsin; stone quarries; a fine stock farm in Southwestern Minnesota, and valuable real estate in St. Paul.
MINNESOTA | ST. PAUL | THEODORE L. SCHURMEIER. | Inherited from his father-in-law, in part. Has been engaged in merchandising dry-goods and clothing, manufacturing boots and shoes, etc.
MINNESOTA | ST. PAUL | COLONEL JOHN MERRIAM. | Contracts, real estate and investments.
MINNESOTA | ST. PAUL | HORACE THOMPSON. | Made in railroads, banking and real estate.
MINNESOTA | ST. PAUL | HENRY HALE. | Rise in value of real estate.
MINNESOTA | ST. PAUL | CONRAD GOTZIAN. | Manufacturing boots and shoes.
MINNESOTA | ST. PAUL | W. F. DAVIDSON. | Steamboating and real estate.
MINNESOTA | ST. PAUL | CHARLES E. DE GRAFF. | Railroad contracting and real estate.
MINNESOTA | ST. PAUL | WILLIAM LINDEKE. | Merchandising and real estate.
MINNESOTA | STILLWATER | ISAAC STAPLES. | Pine lands, lumber, sawmills and store; president of Lumberman’s National Bank and of a savings bank.
MINNESOTA | STILLWATER | JACOB BEAN (of Hersey & Bean). | Pine lands, saw-mills, etc.
MINNESOTA | WINONA | H. W. LAMBERTON. | President of the Winona Deposit Bank. Made in banking and investments.
MINNESOTA | WINONA | V. SIMPSON. | Made in real estate, loans, etc.
MINNESOTA | WINONA | M. G. NORTON (of Laird, Norton & Co.). | Made in pine lands, saw-mills and lumber.
MINNESOTA | WINONA | JAMES L. NORTON (of Laird, Norton & Co.). | Made in pine lands, saw mills and lumber.
MINNESOTA | WINONA | WILLIAM H. LAIRD (of Laird, Norton & Co.). | Pine lands, saw mills and lumber.
MISSISSIPPI | NATCHEZ | R. S. McCLURE. | Loans on notes and other securities.
MISSISSIPPI | NATCHEZ | STEPHEN DUNCAN. | Inherited. Son of the late Dr. Stephen Duncan, one of the largest and wealthiest planters in the South.
MISSOURI | HANNIBAL | JOHN GARTH. | Manufacturing and selling lumber.
MISSOURI | JOPLIN | J. C. LERCY. | Made in the ownership of land, which turned out to have a zinc mine.
MISSOURI | KANSAS CITY | S. B. ARMOUR (of Armour Brothers Packing Company). | Packing beef and pork.
MISSOURI | KANSAS CITY | A. W. ARMOUR (of Armour Brothers’ Packing Company). | Packing beef and pork.
MISSOURI | KANSAS CITY | VICTOR B. BUCK. | Merchandising boots and shoes and rise in real estate.
MISSOURI | KANSAS CITY | KERSEY COATES. | Hotel and rise in real estate.
MISSOURI | KANSAS CITY | J. C. GATES. | Merchandising boots and shoes, and rise in real estate.
MISSOURI | KANSAS CITY | W. E. HALL. | Rise in value of real estate.
MISSOURI | KANSAS CITY | JAMES F. HOLMES. | Rise in value of real estate.
MISSOURI | KANSAS CITY | ALBERT MARTY. | Rise in value of real estate.
MISSOURI | KANSAS CITY | JAMES B. PORTER. | Rise in value of real estate.
MISSOURI | KANSAS CITY | L. J. PORTER. | Rise in value of real estate.
MISSOURI | ST. JOSEPH | MRS. KATE TOOTLE. | Made by her husband, the late Milton Tootle, in wholesale drygoods and real estate investments.
MISSOURI | ST. JOSEPH | MISS FANNIE TOOTLE. | Inherited from her father, Milton Tootle. Made in merchandising and real estate.
MISSOURI | ST. JOSEPH | MILTON TOOTLE, JR. | Inherited from his father, Milton Tootle. Made in merchandising and real estate.
MISSOURI | ST. JOSEPH | JOHN TOOTLE. | Inherited from Milton Tootle. Made in merchandising and real estate.
MISSOURI | ST. JOSEPH | JAMES McCORD, SR. | Made in wholesale grocery business.
MISSOURI | ST. JOSEPH | A. N. SCHUSTER. | Wholesale clothing and private banking. He is also a partner in stores in Hannibal, Mo.; Colorado, Texas; Pueblo, Colo.; and Marysville, Kan. President of the Schuster-Hax National Bank.
MISSOURI | ST. JOSEPH | JOHN S. LOGAN. | Made in mines.
MISSOURI | ST. JOSEPH | RUFUS L. McDONALD (of R. L. McDonald & Co.). | Manufacturing woollen and duck wear. Largest manufacturer of this class of goods in the West. Also merchandising drygoods and notions.
MISSOURI | ST. JOSEPH | WILLIAM M. WYETH. | President of Wyeth Hardware and Manufacturing Co. Made in manufacturing.
MISSOURI | ST. JOSEPH | J. C. PRYOR. | Made in cattle-raising.
MISSOURI | ST. JOSEPH | WILLIAM G. FAIRLEIGH. | Merchandising, drygoods and investments.
MISSOURI | ST. JOSEPH | GEORGE T. HOAGLAND. | Made in lumber trade and money-lending.
MISSOURI | ST. JOSEPH | DUDLEY M. STEELE. | Wholesale groceries and land. He is a partner in stores in Wichita and Omaha, also.
MISSOURI | ST. JOSEPH | CHARLES B. FRANCE. | Banking and investments. President of the State National Bank.
MISSOURI | ST. JOSEPH | LOUIS HAX. | Of the Louis Hax Furniture Company. Made in merchandising carpets, the manufacture of furniture and banking. President of the Central Savings Bank.
MISSOURI | ST. JOSEPH | N. P. OGDEN. | Banking and investments in real estate. President of the Commercial National Bank.
MISSOURI | ST. JOSEPH | THOMAS E. TOOTLE. | Wholesale drygoods.
MISSOURI | ST. JOSEPH | CALVIN F. BURNES. | Law practice, real estate investments, and banking. President of the National Bank of St. Joseph.
MISSOURI | ST. JOSEPH | JAMES N. BURNES. | Made in real estate investments. Daniel D. Burnes and Calvin C. Burnes are legatees.
MISSOURI | ST. JOSEPH | ABRAM NAVE. | Wholesale groceries.
MISSOURI | KANSAS CITY | ISAAC N. RIDGE. | Rise in real estate.
MISSOURI | KANSAS CITY | GEORGE SHEIDLEY. | Rise in real estate.
MISSOURI | KANSAS CITY | LAMON V. HARKNESS (of Harkness, Wyman & Russell). | Banking; he is worth several millions.
MISSOURI | KANSAS CITY | ADAM LONG. | First in wholesale groceries (firm of Long Brothers); then in profitable investments in real estate.
MISSOURI | KANSAS CITY | JOHN LONG. | First in wholesale groceries (firm of Long Brothers); then in profitable investments in real estate.
MISSOURI | KANSAS CITY | GEORGE FOWLER. | Packing meats. The firm of George Fowler & Sons have a plant worth several millions.
MISSOURI | KANSAS CITY | DAVID T. EALS. | Stock ranches, cattle-raising and investments.
MISSOURI | KANSAS CITY | A. L. MASON. | General merchandising and rise in real estate.
MISSOURI | KANSAS CITY | THOMAS H. SWOPE. | Made in rise in real estate.
MISSOURI | KANSAS CITY | THOMAS CORRIGAN. | Street railroad franchises and real estate.
MISSOURI | KANSAS CITY | GEORGE F. WINTER. | Rise in real estate.
MISSOURI | KANSAS CITY | W. S. WOODS. | Banking and stock-raising in South Dakota.
