State | City | Name | Description
NEW YORK | NEW YORK CITY | WALTER S. GURNEE. | Made in banking, brokerage, mining and railroads. Director in the United Smelting and Refining Company, Colorado Smelting Company, Chrysolite Silver Mining Company, American Surety Company, Montana Smelting Company, etc., etc.
NEW YORK | NEW YORK CITY | MRS. LETITIA R. GARRISON. | From her late husband, Cornelius K. Garrison. Made in ocean steamers and railroads.
NEW YORK | NEW YORK CITY | MRS. WM. R. GARRISON. | From her husband, Wm. R. Garrison and his father, Cornelius K. Garrison. Made in ocean steamers and railroads.
NEW YORK | NEW YORK CITY | MALCOLM GRAHAM (of the former firm of Schuyler, Hartley & Graham, now known as Hartley & Graham). | Made in the wholesale jewelry business and dealing in fire arms. Now has an interest in the Remington Arms Company. He inherited some money from his father, Colonel John L. Graham, a merchant.
NEW YORK | NEW YORK CITY | FREDERIC GALLATIN. | Inherited from Albert R. Gallatin. Made in banking and real estate.
NEW YORK | NEW YORK CITY | JAMES GALLATIN. | Inherited from Albert R. Gallatin, banking and real estate.
NEW YORK | NEW YORK CITY | MRS. CHARLOTTE MATILDA GOODRIDGE (wife of Frederic Goodridge). | From her mother, Matilda Ann Grosvenor. Made in merchandising and real estate.
NEW YORK | NEW YORK CITY | MRS. RACHEL M. GILSEY (widow of John Gilsey). | Made by Peter Gilsey, first in merchandising cigars and tobacco at retail, but chiefly in investments in real estate, on Broadway, including the Gilsey House, now exceedingly valuable.
NEW YORK | NEW YORK CITY | ANDREW GILSEY. | Inherited from Peter Gilsey. Made in merchandising and real estate.
NEW YORK | NEW YORK CITY | CHARLES GILSEY. | Inherited from Peter Gilsey. Made as above.
NEW YORK | NEW YORK CITY | PETER GILSEY. | Inherited from Peter Gilsey. Made as above.
NEW YORK | NEW YORK CITY | HENRY GILSEY. | Inherited from Peter Gilsey. Made as above.
NEW YORK | NEW YORK CITY | MRS. LUCY GILSEY (wife of Henry Gilsey). | Inherited from her father, George M. Varlan, a large quantity of real estate, part of an old farm, now overgrown by the city.
NEW YORK | NEW YORK CITY | GEORGE F. GILMAN. | Merchandising tea, and inheritance from his father, Nathaniel Gilman, the leather merchant and tanner.
NEW YORK | NEW YORK CITY | JAMES A. GARLAND. | Has made a large fortune in banking and investments. Vice-President of the First National Bank. Director in the Central Railroad of New-Jersey, Lehigh Valley and Wilkesbarre Coal Company, New York and Long Branch Railroad, Bankers Safe Deposit Company, etc.
NEW YORK | NEW YORK CITY | WILLIAM R. GRACE (of William R. Grace & Co.). | Has made several millions in the export and import trade with South America, and in shipping. Has many investments. Director in the Lincoln National Bank, Lincoln Safe Deposit Company, New-York Bank Note Company, American Sulphur Company of West Virginia, etc.
NEW YORK | NEW YORK CITY | MICHAEL P. GRACE (of William R. Grace & Co.). | Made in trade with South America and shipping.
NEW YORK | NEW YORK CITY | JOHN W. GRACE (of William R. Grace & Co.). | Trade with South America and shipping.
NEW YORK | NEW YORK CITY | RANDOLPH GUGGENHEIMER. | In the practise of law and promoting.
NEW YORK | NEW YORK CITY | JOHN GREEN. | Contracting, street railroads, and for several years president of the Central Safe Deposit Company.
NEW YORK | NEW YORK CITY | MRS. SARAH HELEN GREEN (widow of John C. Green). | From her husband, who made a fortune of several millions in the China trade, first with N. L. & G. Griswold, in New-York City, and then in the house of Russell & Co., in China. He returned later to New-York and engaged in business here, having numerous investments in banks and other companies.
NEW YORK | NEW YORK CITY | CHESTER GRISWOLD. | From his father, John A. Griswold, of Troy, who with John F. Winslow owned the patents for manufacturing Bessemer steel in this country. John A. Griswold began life in the wholesale and retail drug business; a partner next in the Rensselaer Iron Company; and then, by consolidation with Erastus Corning, the owner of the largest rolling mill and iron works in the country, with Bessemer steel works at Troy; blast furnaces at Fort Edward and on the Hudson, and an iron mine in the Champlain region. Chester Griswold is a director in the Hudson River Ore and Iron Company; Colorado Coal and Iron Company; Adirondack Railway, and other enterprises; president of the Crown Point Iron Company.
NEW YORK | NEW YORK CITY | MRS. HARRIET A. GARNER (widow of Thomas Garner). | From her husband, who made a great fortune, amounting to more than $5,000,000, in manufacturing cotton goods. He had large mills at Cohoes, N. Y., and others in Rochester, Little Falls, Pleasant Valley and Newburgh, N. Y., and Reading, Pa., with print works at Wappinger’s Falls and Haverstraw, N. Y.
NEW YORK | NEW YORK CITY | WILLIAM H. GEBHARD. | Importations of foreign liquors and wines. Has numerous investments, including about a million of real estate. Director in the Equitable Gaslight Company.
NEW YORK | NEW YORK CITY | FREDERICK GEBHARD. | Inherited. Made in importing liquors and in real estate.
NEW YORK | NEW YORK CITY | LADY GORDON-CUMMING (Florence Garner). | From Thomas Garner, through his son, William T. Garner her father. Made in manufacturing cotton goods.
NEW YORK | NEW YORK CITY | MAYER GOLDSMITH. | Exportation of cattle.
NEW YORK | NEW YORK CITY | R. SUYDAM GRANT. | Banking, railroads and investments. Director in the Delaware and Hudson Canal Company. President of the Adirondack Railway. In other companies.
NEW YORK | NEW YORK CITY | WILLIAM GRAY. | Made in dealing in sulphur.
NEW YORK | NEW YORK CITY | MRS. JOHN C. GRAY (Grace Townsend-Turnbull). | Inherited from the Townsend family, of Newport.
NEW YORK | NEW YORK CITY | JOHN GARCIA. | General commission merchandising. Had a large estate in Spain.
NEW YORK | NEW YORK CITY | FREDERIC E. GIBERT. | Inherited from his father, a merchant, and invested by him in real estate, storehouses, etc.
NEW YORK | NEW YORK CITY | DR. NORVIN GREEN. | Made in telegraph lines and investments. President of the Western Union Telegraph Company, Gold and Stock Telegraph Company and International Ocean Telegraph Company. Director in the Southern Bell Telephone and Telegraph Company, Dives Pelican Mining Company, American Speaking Telephone Company, Mercantile Trust Company, etc.
NEW YORK | NEW YORK CITY | MRS. HETTY GREEN. | One of the wealthiest women in the world. She inherited several millions from her father, Edward Mott Robinson, of New-York, and her aunt, Sylvia Ann Howland, of New-Bedford. The principal part of the money inherited by her was made in whaling, shipping, foreign trade, etc., and she has increased her fortune greatly by shrewd investments. She is a keen and sharp business woman. Has several millions of real estate in Chicago.
NEW YORK | NEW YORK CITY | JAMES LORIMER GRAHAM. | President of the Metropolitan Insurance Company, and investor.
NEW YORK | NEW YORK CITY | JAMES W. GERARD. | Law practice and investments in real estate and various business enterprises. He had an interest in the Vermont Central Railroad and the Boston Sugar Refinery.
NEW YORK | NEW YORK CITY | ECCLES GILLENDER. | Made in tobacco manufacturing.
NEW YORK | NEW YORK CITY | JOHN GREENOUGH (of Poor & Greenough). | Made his fortune in banking and railroads. Has extensive interests all over the country, and is president of several investment companies in London, which invest their money in this country.
NEW YORK | NEW YORK CITY | HENRY O. HAVEMEYER. | Partly inherited. All made in sugar refining and investment of accumulations. An owner in the Havemeyer Sugar Refining Company, and the Havemeyers & Elder Sugar Refining Company. Director in the American Sugar Refining Company.
NEW YORK | NEW YORK CITY | MRS. HENRY O. HAVEMEYER (Maria Louisa Elder). | From her father, Daniel R. Elder. Made in sugar refining with the Havemeyers, and investments.
NEW YORK | NEW YORK CITY | THEODORE A. HAVEMEYER. | Made in sugar refining with the Havemeyers and Elder. Was a director in the American Sugar Refining Company.
NEW YORK | NEW YORK CITY | WILLIAM M. HAVEMEYER. | Made in sugar refining with the Havemeyers and Elder.
NEW YORK | NEW YORK CITY | WILLIAM F. HAVEMEYER. | Partly inherited from Hector C. Havemeyer. All made in sugar refining and investments.
NEW YORK | NEW YORK CITY | THOMAS J. HAVEMEYER. | Partly inherited from his father, Frederick C. Havemeyer. All made in sugar refining and investments.
NEW YORK | NEW YORK CITY | FREDERIC C. HAVEMEYER. | Sugar refining.
NEW YORK | NEW YORK CITY | LOUIS S. HARGOUS. | Made a fortune in banking in Mexico and subsequently in investments in New-York City.
NEW YORK | NEW YORK CITY | JOHN H. HEWSON (of Hewson & White). | Private banking and investments.
NEW YORK | NEW YORK CITY | HENRY HART. | Local street railroads, stocks, real estate and various other investments. Director in the Third Avenue Railroad and Pacific Mail Steamship Company.
NEW YORK | NEW YORK CITY | ANSON W. HARD (of Hard & Rand). | Importing coffee. Director in the Atlantic Mutual Insurance Company, Bank of New-York, and other concerns.
NEW YORK | NEW YORK CITY | JOHN H. HALL. | Wholesale paper business at first. Then in elevated railroads in New-York City; southern railroads, and other investments. Was a director in the Georgia Central Railroad; East Tennessee, Virginia and Georgia Railroad; Richmond and Danville Railroad; Knoxville and Ohio Railroad; etc., etc.
NEW YORK | NEW YORK CITY | REV. CHARLES F. HOFFMAN. | Inherited from his father, Samuel V. Hoffman. Made in real estate, inherited for several generations.
NEW YORK | NEW YORK CITY | VERY REV. EUGENE A. HOFFMAN. | Inherited from his father, Samuel V. Hoffman. Made in real estate, inherited for several generations.
NEW YORK | NEW YORK CITY | AARON HERSHFIELD. | First in mercantile business; then in investments in real estate, and building houses.
NEW YORK | NEW YORK CITY | EUGENE HIGGINS (of E. S. Higgins & Co.). | Inherited several millions from his father, Elias S. Higgins. Made first in merchandising carpets; then in manufacturing them; accompanied by large purchases of real estate, and the investment of accumulations. Eugene Higgins is a member of the old firm, and director in the Delaware, Lackawanna and Western Railroad; Consolidated Gas Company of New-York; Lackawanna and Western Railroad; Liberty Insurance Company, Central National Bank, etc., etc.
NEW YORK | NEW YORK CITY | RUSSELL H. HOADLEY. | Commission merchandising and trade with South America. He had numerous investments in insurance companies, etc.
NEW YORK | NEW YORK CITY | JOHN C. HAMILTON. | Inherited from the Alexander Hamilton estate. Real estate chiefly.
NEW YORK | NEW YORK CITY | WILLIAM HILLS (of Hills Brothers). | Importation of fruits.
NEW YORK | NEW YORK CITY | HENRY W. HUBBELL. | Made in the China trade and ships to foreign lands.
NEW YORK | NEW YORK CITY | HENRY HILTON. | Law practice, and inheritance from Alexander T. Stewart, the drygoods merchant. Director in the Merchants’ National Bank.
NEW YORK | NEW YORK CITY | JAMES HARRIMAN. | Made a fortune in importing drygoods.
NEW YORK | NEW YORK CITY | J. LOW HARRIMAN. | Importing drygoods.
NEW YORK | NEW YORK CITY | OLIVER HARRIMAN (of Low, Harriman & Co.). | Commission merchandising and investments. Director in the Illinois Central Railroad; Central Trust Company, Bank of America, Bank for Savings, Mutual Life Insurance Company and other corporations.
NEW YORK | NEW YORK CITY | WILSON G. HUNT. | Made in merchandising woollens and investment of profits. Director in the United States Trust Company, National Park Bank, Consolidated Gas Company, Eagle Fire Insurance Company; New-York Life Insurance and Trust Company; New-York, New-Haven and Hartford Railroad; Globe Fire Insurance Company, Washington Life Insurance Company; Delaware, Lackawanna and Western Railroad, etc., etc.
NEW YORK | NEW YORK CITY | JOSEPH W. HARPER (of Harper & Bros.). | Publishing copyrighted books and the “Magazine,” “Weekly,” “Bazar” and “Young People” issued by this great house.
NEW YORK | NEW YORK CITY | JOSEPH ABNER HARPER (of Harper & Bros.). | Made in the publishing business, as above.
NEW YORK | NEW YORK CITY | JOHN W. HARPER (of Harper & Bros.). | Made in the publishing business, as above.
NEW YORK | NEW YORK CITY | JOHN HARPER. | Made in Harper & Bros., publishers.
NEW YORK | NEW YORK CITY | JOSEPH HENRY HARPER. | Made in the publishing business in the firm of Harper & Bros.
NEW YORK | NEW YORK CITY | COLLIS P. HUNTINGTON. | A man of very great fortune, amassed chiefly in building and managing the Central Pacific and Southern Pacific railroads. He has large interests in railroads running to the Pacific Ocean and in the South. President of the Southern Pacific Railroad; Chesapeake, Ohio and Southwestern Railroad; Galveston, Harrisburg and San Antonio Railway; Guatemala Central Railroad, and the Mexican International Railroad. Large owner and director in the Pacific Mail Steamship Company; Texas and New-Orleans Railroad Company; United States and Brazil Mail Steamship Company; Central Pacific Railroad Company; Southern Pacific Company; Old Dominion Land Company; Chesapeake Central Railroad; Morgan’s Louisiana and Texas Railroad and Steamship Company; Western Union Telegraph Company; Metropolitan Trust Company; Newport News and Mississippi Valley Company, etc., etc.
NEW YORK | NEW YORK CITY | PRINCESS HATZFELD. | From her father, Collis P. Huntington.
NEW YORK | NEW YORK CITY | JOHN E. HOFFMIRE (of John E. Hoffmire & Sons). | Joinery business, river steamboating and street railroads. Has numerous investments. Is in the New-York and Norwalk Steamboat Company.
NEW YORK | NEW YORK CITY | HIRAM HITCHCOCK (of Hitchcock, Darling & Co.). | Made largely in the Fifth Avenue Hotel. Director in the Nicaragua Canal Company; Garfield National Bank; Garfield Safe Deposit Company; Indianapolis, Decatur and Quincy Railway; Madison Square Garden Company, etc.
NEW YORK | NEW YORK CITY | BENJAMIN H. HUTTON. | Importing French silks, and large investments in real estate. He had more than $1,000,000 worth of real estate.
NEW YORK | NEW YORK CITY | WILLIAM S. HAWK. | Made chiefly in the hotel business. Inherited from his father, Samuel Hawk.
NEW YORK | NEW YORK CITY | CHARLES C. HASTINGS. | Clothing business in San Francisco and real-estate investments here.
NEW YORK | NEW YORK CITY | MRS. LAURA P. HAZARD (wife of William A. Hazard). | Inherited from Samuel J. Tilden, who made a fortune in law, elevated roads, etc.
NEW YORK | NEW YORK CITY | WILLIAM H. HALL (of Hall & Ruckel). | Wholesale drugs.
NEW YORK | NEW YORK CITY | MARCELLUS HARTLEY (of the old firm of Schuyler, Hartley & Graham, now Hartley & Graham). | Has made a fortune in the wholesale jewelry business, and sale of firearms. President of the Remington Arms Company. Director in the Equitable Life Assurance Society; German-American Bank; Liberty Insurance Company; Lincoln National Bank; United States Electric Lighting Company; Western National Bank; Mercantile Trust Company, etc., etc. President of the Mutual District Telegraph Company and Mutual District Messenger Company.
NEW YORK | NEW YORK CITY | ALFRED S. HEIDELBACH (of Heidelbach, Ickelheimer & Co.). | Private banking and stocks.
NEW YORK | NEW YORK CITY | MRS. CLARENCE E. HYDE. | Inherited from B. T. Babbitt, her father. Made in the manufacture of soda, saleratus, potash and soap.
NEW YORK | NEW YORK CITY | MRS. FREDERICK E. HYDE. | Inherited from her father, B. T. Babbitt. Made in the manufacture of soda, saleratus, potash and soap.
NEW YORK | NEW YORK CITY | MRS. MATILDA HALLGARTEN. | From her late husband, Julius Hallgarten, of Hallgarten & Co., the Broad-st. brokers.
NEW YORK | NEW YORK CITY | ALBERT HALLGARTEN. | From his father, Julius Hallgarten. Banking, brokerage and stocks.
NEW YORK | NEW YORK CITY | DR. FREDERICK HUMPHREYS. | Manufacture of homoeopathic family medicines. President of Humphreys Homeopathic Medicine Company.
NEW YORK | NEW YORK CITY | EDGAR HENDRICKS (of Hendricks Brothers). | Metal merchandising.
NEW YORK | NEW YORK CITY | EDMUND HENDRICKS (of Hendricks Bros.). | Metal merchandising.
NEW YORK | NEW YORK CITY | HARRY B. HOLLINS (of H. B. Hollins & Co.). | Banking and investments. President of the Metropolitan Ferry Company; director in the Knickerbocker Trust Company, etc.
NEW YORK | NEW YORK CITY | MRS. ANNIE L. HOE. | From her father, David Dows. Made in grain and railroads.
NEW YORK | NEW YORK CITY | EDWARD HAIGHT. | Made in importing cloth and tailors’ trimmings, and investments in banks, etc.
NEW YORK | NEW YORK CITY | DAVID HENRY HAIGHT. | Merchandising drygoods and hatters’ supplies, with large investments in real estate. He had over $1,000,000 of real estate in Broadway alone.
NEW YORK | NEW YORK CITY | ABRAM S. HEWITT (of Cooper, Hewitt & Co.). | Made in the manufacture of iron, isinglass and glue. Director in the Chrysolite Silver Mining Company; Lehigh Coal and Navigation Company; Montana Smelting Company; New-York and Greenwood Lake Railway; American Electric Elevator Company; United Smelting and Refining Company, etc., etc.
NEW YORK | NEW YORK CITY | Mrs. SARAH AMELIA HEWITT (wife of Abram S. Hewitt). | Inherited from her father, Peter Cooper. Made in manufacturing iron, isinglass and glue.
NEW YORK | NEW YORK CITY | Mrs. SUSAN HERTZ (wife of Christian A. Hertz, M. D.). | Inherited from her father, David Dows. Made in grain and railroads.
NEW YORK | NEW YORK CITY | THOMAS V. HITCHCOCK. | Part owner of “The New-York Sun.” Partly inherited, and added to by shrewd investments in real estate, stocks and corporations.
NEW YORK | NEW YORK CITY | ROBERT HOE (of R. Hoe & Co.). | Manufacturing patented printing presses. Has investments in various corporations. Director in the Metropolitan Trust Company, etc.
NEW YORK | NEW YORK CITY | MRS. ROBERT HOE (Olivia P. James). | From her father, the London member of the firm of Phelps, Dodge & Co.
NEW YORK | NEW YORK CITY | Mrs. HELEN MARIA HOYT (widow of Jesse Hoyt). | From her husband, who made a great fortune in the grain and flour commission business, and in investments in pine lands and real estate in Michigan, and in railroads. He bought large tracts of pine in Michigan; and East Saginaw is built on land owned by him. Built hotels, cottages and banks. Was in many Michigan and Minnesota railroads and the Chesapeake and Ohio Railroad.
NEW YORK | NEW YORK CITY | ALFRED M. HOYT. | In the grain and flour commission business with his brother, Jesse Hoyt, and in banking afterward. Also by inheritance from Jesse Hoyt.
NEW YORK | NEW YORK CITY | REUBEN HOYT. | From his brother, Jesse Hoyt.
NEW YORK | NEW YORK CITY | LOUIS T. HOYT. | Made in the stock brokerage business.
NEW YORK | NEW YORK CITY | WILLIAM HOYT (of Hoyt Brothers). | Tanning and leather business.
NEW YORK | NEW YORK CITY | EDWARD C. HOYT (of Hoyt Brothers). | Made in tanning and leather.
NEW YORK | NEW YORK CITY | Mrs. MARY W. HAMILTON (widow of James A. Hamilton). | Inherited from her father, Thomas Suffern, a linen importer and merchant and investor in real estate.
NEW YORK | NEW YORK CITY | ALVIN HIGGINS. | Made in carpet manufacturing with his brother, E. S. Higgins; and in real estate investments.
NEW YORK | NEW YORK CITY | JAMES HOOKER HAMERSLEY. | Inherited through his father, John W. Hamersley. Made in real estate.
NEW YORK | NEW YORK CITY | JACOB HAYS. | Partly inherited from his father, William H. Hays. Made in banking; the Eighth and Ninth Avenue street railroads; gas companies; the People’s Line of steamboats on the Hudson; railroads; the Brooklyn Ferry Company, etc. Jacob is a director in the Consolidated Electric Light Company, Eighth Avenue Railroad; Brooklyn and New-York Ferry; Knickerbocker Trust Company, etc., etc.
NEW YORK | NEW YORK CITY | E. ST. JOHN HAYS (of E. St. John Hays & Co., bankers and brokers). | Partly inherited from his father, William H. Hays, and made as above. Director in the Eighth Avenue Railroad; engaged in banking and brokerage.
NEW YORK | NEW YORK CITY | HENRY L. HOGUET. | Banking, brokerage and investments in real estate and securities.
NEW YORK | NEW YORK CITY | GEORGE G. HAVEN. | Banking and investments. Director in the Bank of New-Amsterdam; Manufacturing Investment Company; Metropolitan Opera House Company; New-York, Providence and Boston Railroad; Providence and Stonington Steamship Company; New-York and Northern Railway; Quicksilver Mining Company, etc., etc.
NEW YORK | NEW YORK CITY | MRS. GEORGE G. HAVEN. | From her father, John Arnot, of Elmira, the great banker. Made in banking.
NEW YORK | NEW YORK CITY | EDWARD HEN. | Merchandising tobacco and smokers’ articles; exportation of American goods to the Isthmus, and speculation in Wall Street.
NEW YORK | NEW YORK CITY | MRS. ANNETTE W. W. HICKS-LORD. | From her late husband, Thomas Lord, who made a fortune in merchandising and real estate.
NEW YORK | NEW YORK CITY | HENRY A. HURLBUT. | Made a fortune in the manufacture of hats and caps, and investment of profits. Director in the Second National Bank; Fifth Avenue Safe Deposit Company; Mercantile Safe Deposit Company; Mercantile Trust Company; Equitable Life Assurance Society; Fidelity and Casualty Company; Forty-second Street and Grand Street Ferry Railroad; Home Insurance Company, etc., etc.
NEW YORK | NEW YORK CITY | GEORGE HARDIN. | Importation of linen and merchandising drygoods.
NEW YORK | NEW YORK CITY | MRS. MARY M. HECKSCHER (wife of John G. Heckscher). | From her father, William R. Travers. Made in Wall Street.
NEW YORK | NEW YORK CITY | WILLIAM HEGEMAN. | Merchandising drugs.
NEW YORK | NEW YORK CITY | EDGAR HOLLIDAY (of Read, Holliday & Sons). | In the manufacture of aniline dyes, and in real estate, electric light and other investments. He is president of the company.
NEW YORK | NEW YORK CITY | CHARLES G. HAVENS. | Inherited a large fortune from his wife.
NEW YORK | NEW YORK CITY | WILLIAM H. HARBECK. | Has made a large fortune in ships, ocean freighting, staves, etc.
NEW YORK | NEW YORK CITY | ADRIAN ISELIN. | Made a large fortune in the importation of drygoods, and judicious investment of profits; in banking, etc. Director in Metropolitan Opera House and Manhattan Storage Warehouse Company.
NEW YORK | NEW YORK CITY | ADRIAN ISELIN, JR. (of A. Iselin & Co.). | Made originally in the importation of drygoods, followed by banking and investments in railroads, etc. Director in the Buffalo, Rochester and Pittsburg Railway, Central Trust Company, Gallatin National Bank, Mobile and Ohio Railroad, Sixth National Bank, Manhattan Storage and Warehouse Company, etc. President of the Metropolitan Improvement Company.
NEW YORK | NEW YORK CITY | WILLIAM E. ISELIN (of William Iselin & Co.). | Importation of drygoods.
NEW YORK | NEW YORK CITY | ISAAC ISELIN. | Made in banking, brokerage and stocks.
NEW YORK | NEW YORK CITY | MRS. C. OLIVER ISELIN. | By inheritance from William T. Garner, her father. Made in cotton manufacturing.
NEW YORK | NEW YORK CITY | COLUMBUS O’D. ISELIN. | Banking, brokerage and stocks.
NEW YORK | NEW YORK CITY | RICHARD IRVIN (of Richard Irvin & Co.). | Banking and investments. Director in the Commercial Company ; New York, Ontario and Western Railroad, etc.
NEW YORK | NEW YORK CITY | WILLIAM B. ISHAM. | Tanning and leather, and investments in stocks.
NEW YORK | NEW YORK CITY | BRAYTON IVES (of J. B. Metcalf & Co.). | Made in banking and brokerage business. President of the Western National Bank. Director in the Mercantile Trust Company; New-York Stock Exchange Building Company, etc.
NEW YORK | NEW YORK CITY | SAMUEL INSLEE (of Calhoun, Robbins & Co.). | Merchandising fancy drygoods, and advance in value of real estate.
NEW YORK | NEW YORK CITY | JOHN H. INMAN (of Inman, Swan & Co.). | Partly inherited from his father, a cotton merchant. Largely increased by himself by his own great business ability, first in the cotton commission business and, after 1884, in railroads. President of the Richmond and Danville Railroad. Director in nearly all the railroads of the South, among them the Louisville and Nashville; East Tennessee, Virginia and Georgia; and Memphis and Charleston. Also director in the American Cotton Oil Company; American Surety Company; Fourth National Bank; Home and Liberty Insurance companies, etc. One of the founders of the Cotton Exchange in New-York City.
NEW YORK | NEW YORK CITY | ISAAC ICKELHEIMER (of Heidelbach, Ickelheimer & Co.). | Private banking. Director in the Importers and Traders’ National Bank.
NEW YORK | NEW YORK CITY | Mrs. ADELIA DUANE P. IRELAND (wife of John B. Ireland). | Inherited from the Pell family. Made in real estate.
NEW YORK | NEW YORK CITY | D. WILLIS JAMES (of Phelps, Dodge & Co.). | Partly inherited from his father, who was the London member of the firm. Added to largely by himself. The fortune has been made in the importation of metals, and investments. Director in the Ansonia Brass and Copper Company, Copper Queen Consolidated Mining Company, United States Trust Company, etc., etc.
NEW YORK | NEW YORK CITY | JOHN JAY. | Real estate, inherited. President of the Robinson Consolidated Mining Company.
NEW YORK | NEW YORK CITY | JOHN TAYLOR JOHNSTON. | Merchandising by his father, and railroads by himself. Director in the New-York Life Insurance and Trust Company, Central and New-Jersey Land Improvement Company, Dolphin Manufacturing Company (jute goods), etc., etc.
NEW YORK | NEW YORK CITY | MRS. LAURA HALL JENNINGS (wife of Frederick B. Jennings). | From her father, Trenor W. Park, who made a fortune, first, in law, then in the Mariposa Mine and real estate in California, then in railroads in Vermont, and in the Panama Railroad, which he sold to the De Lesseps’ Canal Company at a large profit.
