State | City | Name | Description
ALABAMA | ANNISTON | A. L. TYLER | Mining and rise in real estate.
ALABAMA | BIRMINGHAM | HENRY F. DE BARDELEBEN | Chiefly in coal and iron properties. He has a large amount of property and is engaged in several large industrial enterprises in coal, iron and land. He is the controlling owner in the De Bardeleben Coal and Iron Company.
ALABAMA | BIRMINGHAM | DR. HENRY M. CALDWELL | Chiefly real estate and lumber. He is president of Elyton Land Company, and Birmingham Trust and Savings Company.
ALABAMA | BIRMINGHAM | W. A. WALKER | Rise in real estate.
ALABAMA | BIRMINGHAM | T. T. HILLMAN | Iron manufacturing.
ALABAMA | BIRMINGHAM | JOHN T. MILNER | Pine and coal lands.
ALABAMA | GADSDEN | ROBERT B. KYLE | Sawmills and real estate.
ALABAMA | MONTGOMERY | JOSIAH MORRIS | Private banking and real-estate speculation in Birmingham. He organized the Elyton Land Company and is its largest stockholder. The company has been a great success on account of the founding of the city and its subsequent growth.
CALIFORNIA | BAKERSFIELD | J. B. HAGGIN | Stock farm; Anaconda copper mine, and real estate.
CALIFORNIA | CHICO | JOHN BIDWELL | Surveying, ranches, and fruit growing.
CALIFORNIA | CHICO | DR. HUGH GLENN | Wheat-farming on a large scale, and lands.
CALIFORNIA | CHINO RANCH | RICHARD GIRD | Ranches and farming.
CALIFORNIA | RIVERSIDE | Dr. JAMES P. GREVES | Iron and copper mining in Lake Superior region; silver mines in Nevada, and lands in California.
CALIFORNIA | LOS ANGELES | HARRIS NEWMARK | Dealing in wool and hides.
CALIFORNIA | LOS ANGELES | H. W. HELLMAN | Wholesale groceries and liquors.
CALIFORNIA | LOS ANGELES | KASPAR KOHN | Dealing in wool and hides.
CALIFORNIA | LOS ANGELES | MRS. R. S. BAKER | From her first husband, Don Abel Stearns. Made in city real estate and stock-raising. Owner in vast cattle and grain ranches.
CALIFORNIA | LOS ANGELES | COLONEL R. S. BAKER | Cattle raising and real estate. He has great cattle and grain ranches and valuable city real estate.
CALIFORNIA | LOS ANGELES | MAJOR GEORGE H. BONEBRAKE | Real estate and banking. President of the Los Angeles National Bank and of the State Loan and Trust Company.
CALIFORNIA | LOS ANGELES | D. FREEMAN | Farming on a large scale and real estate.
CALIFORNIA | LOS ANGELES | L. PHILLIPS | Farming on a large scale and real estate.
CALIFORNIA | LOS ANGELES | E. F. SPENCE | Banking and real estate. President of the First National Bank and of the Savings Bank of Southern California.
CALIFORNIA | LOS ANGELES | J. B. LANKERSHIM | Real estate and banking. President of the Main Street Savings Bank and Trust Company.
CALIFORNIA | LOS ANGELES | ISAIAS W. HELLMAN | Banking and real estate. President of the Farmers' and Merchants' Bank.
CALIFORNIA | LOS ANGELES | L. L. BRADBURY | Reputed to be the richest man in Southern California. California mines; stocks and real estate in Oakland and Southern California.
CALIFORNIA | LOS ANGELES | JOHN S. VOSBURG | Arizona mines and Southern California real estate.
CALIFORNIA | LOS ANGELES | L. J. ROSE | Fruit raising, wine-making and lands. He sold his famous “Sunny Slope” fruit ranch in San Gabriel Valley during the boom of 1887 to an English syndicate for over a million dollars.
CALIFORNIA | OAKLAND | Mrs. CATHERINE GARCELO | She was a sister of Dr. Samuel Merritt, a Forty-Niner, who left her $3,000,000. Made in hotel business, real estate, and loans.
CALIFORNIA | OAKLAND | GEORGE W. GRAYSON (of Grayson, Owens & Co.) | Silver mines, wine dealing; but chiefly lands and cattle; and sale of meat.
CALIFORNIA | OAKLAND | HORACE H. SEATON | Merchandising and trade.
CALIFORNIA | OAKLAND | J. C. AINSWORTH | Steamboating on the Columbia and Willamette rivers in partnership with R. R. Thompson and S. G. Reed; real estate in Portland, Ore., and in the State of Washington, and banking.
CALIFORNIA | SACRAMENTO | EDGAR MILLS | President of D. O. Mills & Co.'s bank; banking and real estate.
CALIFORNIA | SACRAMENTO | MRS. MARGARET B. CROCKER (widow of Judge E. B. Crocker) | Made in Central Pacific Railroad.
CALIFORNIA | SACRAMENTO | NEWTON BOOTH | Wholesale importation of groceries and dealing in the same. He is still a member of the old firm of Booth & Co., wholesale grocers.
CALIFORNIA | SACRAMENTO | A. COOLUT | Importing tobacco, cigars, ammunition and notions, in part. His wealth came largely, however, from the Central Pacific Railroad, of which he was an original stockholder.
CALIFORNIA | SACRAMENTO | WILLIAM LAND | Hotel business and loans.
CALIFORNIA | SACRAMENTO | FREDERICK COX (of Cox & Clark) | Cattle-raising and land.
CALIFORNIA | SACRAMENTO | C. W. CLARK (of Cox & Clark) | Cattle-raising and land.
CALIFORNIA | SACRAMENTO | JEFFERSON WILCOXSON | Dealing in cattle and sheep; real estate, loans and warehouse at Williams.
ARKANSAS | CITY OF LITTLE ROCK | LOGAN H. ROOTS | Banking; mail carrying; railroads; real estate; and introducing telephone service in Texas and Arkansas. His first efforts were in cotton-raising after the war. He is a director in the Arkansas and Gulf Railroad, St. Louis, Iron Mountain and Southern Railroad; Consolidated Refrigerating Company, etc.
ARKANSAS | CITY OF LITTLE ROCK | P. K. ROOTS | Banking, cotton raising, real estate, etc.
ARKANSAS | CITY OF LITTLE ROCK | COLONEL ZEBULON WARD | Cotton plantations and leasing penitentiaries.
ARKANSAS | CITY OF LITTLE ROCK | R. W. MARTIN | Trading and loaning money on plantations and real estate.
ARKANSAS | CITY OF LITTLE ROCK | W. J. THOMPSON | Trading and loaning money on plantations and investments in real estate.
ARKANSAS | CITY OF LITTLE ROCK | STEPHEN W. DORSEY | Railroads in Arkansas; stage mail contracts; mining speculations; and ranch and cattle in New-Mexico.
CALIFORNIA | SACRAMENTO | ALLEN TOWLE | Timber land and lumber manufacturing in Placer County.
CALIFORNIA | SACRAMENTO | AUGUST HEILBRON | Raising and slaughtering cattle, and hardware business.
CALIFORNIA | SACRAMENTO | E. HEILBRON | Raising and slaughtering cattle and hardware merchandising in partnership with August Heilbron.
CALIFORNIA | SAN FRANCISCO | JOHN W. ALLYNE | Oils and real estate.
CALIFORNIA | SAN FRANCISCO | O. D. BALDWIN | Mines and real estate.
CALIFORNIA | SAN FRANCISCO | L. L. BAKER | Manufacturing agricultural machinery and wholesale hardware.
CALIFORNIA | SAN FRANCISCO | J. BRANDENSTEIN | Merchandising and lands.
CALIFORNIA | SAN FRANCISCO | ARCH. BORLAND (of Grayson & Co.) | Land, cattle-raising and mines.
CALIFORNIA | SAN FRANCISCO | ALPHEUS BULL | Insurance; silver and other mines; speculation and banking. He was interested in the Big Bonanza mines and left an estate of several millions.
CALIFORNIA | SAN FRANCISCO | E. J. BALDWIN | Hotels, mining and real estate.
CALIFORNIA | SAN FRANCISCO | THOMAS BELL | Quicksilver mines and commission merchandising.
CALIFORNIA | SAN FRANCISCO | W. B. BOURNE | Real estate and investments.
CALIFORNIA | SAN FRANCISCO | HENRY BABCOCK | Merchandising and real estate.
CALIFORNIA | SAN FRANCISCO | T. H. BLYTHE | City real estate. He made a fortune of several millions.
CALIFORNIA | SAN FRANCISCO | J. T. BOYD | Real estate and street railroads.
CALIFORNIA | SAN FRANCISCO | ALFRED BOREL (of Alfred Borel & Co.) | Private banking, and lands.
CALIFORNIA | SAN FRANCISCO | DAVID BIXLER | Silver and gold mines, and real-estate investments.
CALIFORNIA | SAN FRANCISCO | EDWARD BARRON | Quicksilver mines.
CALIFORNIA | SAN FRANCISCO | PRINCESS GALATIO COLONNA (Paris) | From her father, John W. Mackay, made in the Bonanza silver mines.
CALIFORNIA | SAN FRANCISCO | ALFRED A. COHEN | Attorney for Central Pacific and other roads. In Oakland Ferry, real estate, etc.
CALIFORNIA | SAN FRANCISCO | JULES CERF | Real estate.
CALIFORNIA | SAN FRANCISCO | GEORGE W. CROCKER | Railroads and lands.
CALIFORNIA | SAN FRANCISCO | MRS. CLARK W. CROCKER | Railroads and lands.
CALIFORNIA | SAN FRANCISCO | R. D. CHANDLER | Dealing in coal and pig iron.
CALIFORNIA | SAN FRANCISCO | W. H. COWELL | Manufacturing lime and investments in timber lands.
CALIFORNIA | SAN FRANCISCO | JOHN CARROLL | Merchandising and real estate.
CALIFORNIA | SAN FRANCISCO | CHARLES F. CROCKER | Inherited from Charles Crocker, who made a great fortune in the Central Pacific Railroad and lands. Charles F. Crocker is vice-president of that road and a director in Wells, Fargo & Co.’s Express Company.
CALIFORNIA | SAN FRANCISCO | WILLIAM H. CROCKER | Inherited from Charles Crocker and made in the Central Pacific Railroad, and lands.
CALIFORNIA | SAN FRANCISCO | FREDERICK CROCKER | Railroads and lands. Inherited from Charles Crocker.
CALIFORNIA | SAN FRANCISCO | MARIA COLEMAN (Sister of W. S. O’Brien) | Mines, etc.
CALIFORNIA | SAN FRANCISCO | JAMES V. COLEMAN | Rise in real estate.
CALIFORNIA | SAN FRANCISCO | MRS. ARCHIBALD C. D. DICK (London) | From her father, Parrott, the banker. Made in mines, banking and real estate.
CALIFORNIA | SAN FRANCISCO | J. S. DOE | Real estate and manufacturing doors, sashes, blinds and building.
CALIFORNIA | SAN FRANCISCO | COLL. DEANE | Banking, brokerage and speculation.
CALIFORNIA | SAN FRANCISCO | WILLIAM DUNPHY | Wholesale cattle and lands.
CALIFORNIA | SAN FRANCISCO | S. P. DEWEY | Speculation in mining shares.
CALIFORNIA | SAN FRANCISCO | MRS. PETER DONAHUE | Iron manufacturing, gas and investments.
CALIFORNIA | SAN FRANCISCO | MRS. J. MERVYN DONAHUE | Inherited from her husband. Made in gas stock, iron manufacturing, etc.
CALIFORNIA | SAN FRANCISCO | C. J. DEMPSTER | Merchandising and real estate.
CALIFORNIA | SAN FRANCISCO | J. A. DONOHUE | Private banking, real estate, gas and mines.
CALIFORNIA | SAN FRANCISCO | BARTLETT DOE | Manufacturing doors, sashes and blinds, building and real estate.
CALIFORNIA | SAN FRANCISCO | WALTER E. DEANE | Made in mines.
CALIFORNIA | SAN FRANCISCO | A. E. DAVIS | Railroads and mines.
CALIFORNIA | SAN FRANCISCO | HORACE DAVIS | Flour-milling chiefly.
CALIFORNIA | SAN FRANCISCO | M. H. DE YOUNG | Publishing “The Daily Chronicle,” and investments in real estate.
CALIFORNIA | SAN FRANCISCO | J. ENRIGHT | Real estate and lands.
CALIFORNIA | SAN FRANCISCO | E. E. EYER | Mines and speculation.
CALIFORNIA | SAN FRANCISCO | J. O. EARLE | Speculation in mining shares.
CALIFORNIA | SAN FRANCISCO | JAMES G. FAIR, Jr. | Silver mines and speculation. Inherited from his father, James G. Fair, who was interested in the Big Bonanza mines.
CALIFORNIA | SAN FRANCISCO | CHARLES FAIR | Silver mines and speculation. Inherited from James G. Fair.
CALIFORNIA | SAN FRANCISCO | MISS VIRGINIA FAIR | Silver mines and speculation. Inherited.
CALIFORNIA | SAN FRANCISCO | MRS. JAMES C. FLOOD | Silver and gold mines; banking and real estate. Inherits from her husband.
CALIFORNIA | SAN FRANCISCO | MISS CORA JANE FLOOD | Inherited from her father, James C. Flood. Made in mines, banking and real estate.
CALIFORNIA | SAN FRANCISCO | JAMES L. FLOOD | Inherited from James C. Flood. mines, banking and real estate.
CALIFORNIA | SAN FRANCISCO | C. N. FELTON | Mines and real estate.
CALIFORNIA | SAN FRANCISCO | LADY FLORENCE EMILY FENNER-HESKETH (wife of Sir Thomas G. F. Fenner-Hesketh, England) | From her father, William Sharon. Made in silver mines, banking, railroads, etc.
CALIFORNIA | SAN FRANCISCO | W. R. FULLER (of Whittier, Fuller & Co.) | Made a large fortune in dealing in paints, oils and glass.
CALIFORNIA | SAN FRANCISCO | E. L. GOLDSTEIN (of B. Dreyfus & Co.) | Mfg. California wines and very valuable city real estate.
CALIFORNIA | SAN FRANCISCO | LEWIS GERSTLE | Importing furs and merchandising in the Alaska Commercial Company.
CALIFORNIA | SAN FRANCISCO | ADAM GRANT | Merchandising, drygoods and lands.
CALIFORNIA | SAN FRANCISCO | WILLIAM T. GARRATT | Foundry business; then railroads, steamship investments and mining.
CALIFORNIA | SAN FRANCISCO | ALVINZA HAYWARD | Silver and gold mines; Gold Hill Water Company; railroads and real estate.
CALIFORNIA | SAN FRANCISCO | S. C. HASTINGS | Law and investments.
CALIFORNIA | SAN FRANCISCO | CHARLES WEBB HOWARD | Water company and stocks.
CALIFORNIA | SAN FRANCISCO | E. S. HELLER | Wholesale drygoods.
CALIFORNIA | SAN FRANCISCO | A. P. HOTALING | Wholesale liquors and real estate.
CALIFORNIA | SAN FRANCISCO | E. W. HOPKINS | Made in the Central Pacific Railroad.
CALIFORNIA | SAN FRANCISCO | TIMOTHY HOPKINS | Mines and the Central Pacific Railroad. He was the adopted son of Mark Hopkins, from whom he received a large legacy; and he obtained $3,000,000 from the estate of Mrs. Hopkins-Searles, to whom Mark Hopkins left the bulk of his great fortune of over $20,000,000. Treasurer of the Central Pacific Railroad and director in the Southern Pacific.
CALIFORNIA | SAN FRANCISCO | MOSES HOPKINS | Inherited from Mark Hopkins, who made a great fortune in the Central Pacific Railroad and in mines.
CALIFORNIA | SAN FRANCISCO | WILLIAM S. HOPKINS | From Mark Hopkins, who made a great fortune in the Central Pacific Railroad and in mines.
CALIFORNIA | SAN FRANCISCO | C. F. D. HASTINGS | Made in merchandising and real estate.
CALIFORNIA | SAN FRANCISCO | MR. HUTCHINSON | Head of the Alaska Fur Company. Made in the fur business.
CALIFORNIA | SAN FRANCISCO | GEORGE HEARST | Silver, gold and copper mines, banking and real estate.
CALIFORNIA | SAN FRANCISCO | W. R. HEARST | Silver, gold and copper mines, banking and real estate.
CALIFORNIA | SAN FRANCISCO | W. S. HOBART. | Silver mines, speculation and Gold Hill Water Co.
CALIFORNIA | SAN FRANCISCO | A. E. HEAD. | Speculation in mining shares.
CALIFORNIA | SAN FRANCISCO | JAMES IRVINE. | Merchandising and land.
CALIFORNIA | SAN FRANCISCO | JOHN P. JONES. | Silver and gold mines, speculation and banking.
CALIFORNIA | SAN FRANCISCO | M. P. JONES. | Merchandising and real estate.
CALIFORNIA | SAN FRANCISCO | ROBERT JOHNSON. | Merchandising iron.
CALIFORNIA | SAN FRANCISCO | JEFFERSON G. JAMES. | Cattle raising and lands.
CALIFORNIA | SAN FRANCISCO | J. G. KITTLE. | Merchandising and real estate.
CALIFORNIA | SAN FRANCISCO | MICHAEL J. KELLY. | Made in lands and real estate.
CALIFORNIA | SAN FRANCISCO | WILLIAM M. LENT. | Silver and other mines in California and Colorado and speculation.
CALIFORNIA | SAN FRANCISCO | NICHOLAS LUNING. | Real estate and loans.
CALIFORNIA | SAN FRANCISCO | CHARLES LUX (of Miller & Lux). | Cattle-raising and lands.
CALIFORNIA | SAN FRANCISCO | MR. LEWIS (of Allen & Lewis). | Commission grain.
CALIFORNIA | SAN FRANCISCO | JEROME LINCOLN. | Merchandising and banking.
CALIFORNIA | SAN FRANCISCO | JAMES LICK. | Merchandising and rise in real estate. He owned an enormous amount of real estate, including fifty lots in San Francisco, a large tract in Placer County, and the island of Cata, Catalina, containing 50,000 acres, lying off Los Angeles. He founded the Lick Observatory.
CALIFORNIA | SAN FRANCISCO | JOHN W. MACKAY. | Made in the Big Bonanza silver mines, banking and speculation. Director in the Commercial Cable Company.
CALIFORNIA | SAN FRANCISCO | J. L. MOODY. | Merchandising and real estate.
CALIFORNIA | SAN FRANCISCO | ANDREW B. McCREARY. | Speculation in mining shares and real estate.
CALIFORNIA | SAN FRANCISCO | CHARLES MAIN (of Main & Winchester). | Manufacturing harness in Portsmouth, N. H., and sale of goods here. Added to by investments in real estate.
CALIFORNIA | SAN FRANCISCO | ROBERT F. MORROW. | Silver and other mines and speculation.
CALIFORNIA | SAN FRANCISCO | DANIEL MEYER. | Banking and investments.
CALIFORNIA | SAN FRANCISCO | HENRY MILLER (of Miller & Lux). | Wholesale cattle-raising and lands.
CALIFORNIA | SAN FRANCISCO | DR. R. H. McDONALD (of the Pacific Bank). | Finance and banking.
CALIFORNIA | SAN FRANCISCO | THOMAS MAGEE. | Real estate.
CALIFORNIA | SAN FRANCISCO | CHARLES McLAUGHLIN. | Railroads and lands.
CALIFORNIA | SAN FRANCISCO | MRS. McDONOUGH. | From W. S. O’Brien. Made in silver mines, etc.
CALIFORNIA | SAN FRANCISCO | JAMES N. McDONALD. | Merchandising, mines and real estate.
CALIFORNIA | SAN FRANCISCO | DR. JOHN R. NIGHTINGALE. | Investments in real estate.
CALIFORNIA | SAN FRANCISCO | FRANCIS G. NEWLANDS. | From William Sharon. Made in silver mines, etc.
CALIFORNIA | SAN FRANCISCO | WILLIAM NORRIS. | Made in overland express business and banking in Wells, Fargo & Co. Secretary of the company.
CALIFORNIA | SAN FRANCISCO | CORNELIUS O’CONNOR. | Real estate and stocks.
CALIFORNIA | SAN FRANCISCO | JAMES F. ORTMAN. | Groceries and real estate.
CALIFORNIA | SAN FRANCISCO | TIBURCIO PARROTT. | Inherited. Made in mines, buildings, real estate and banking.
CALIFORNIA | SAN FRANCISCO | JOHN PARROTT. | Made in mines, banking and real estate.
CALIFORNIA | SAN FRANCISCO | JAMES PHELAN. | A ’49er. For thirty years an importer and dealer in merchandise and has investments in real estate. Is worth several millions.
CALIFORNIA | SAN FRANCISCO | GEORGE C. PERKINS. | Merchandising and mines.
CALIFORNIA | SAN FRANCISCO | EDMUND PATTEN. | Speculation in mining shares.
CALIFORNIA | SAN FRANCISCO | MRS. JOHN A. PAXTON. | Banking and mines.
CALIFORNIA | SAN FRANCISCO | A. J. POPE (of Pope & Talbot). | Manufacturing lumber; timber lands, and vessels. The firm has large interests at Port Gamble, Wash.
CALIFORNIA | SAN FRANCISCO | DR. E. B. PERRIN. | Lands.
CALIFORNIA | SAN FRANCISCO | MRS. M. A. PARROTT. | Banking, mines, real estate, etc. John Parrott, her husband, was a pioneer.
CALIFORNIA | SAN FRANCISCO | GEORGE W. PRESCOTT. | Made in the Union Iron Works and investments.
CALIFORNIA | SAN FRANCISCO | HENRY PIERCE. | Dealing in grain and judicious investments.
CALIFORNIA | SAN FRANCISCO | MOSES ROSENBAUM. | Real estate and merchandising.
CALIFORNIA | SAN FRANCISCO | WILLIAM C. RALSTON. | Silver mines, speculation and banking.
CALIFORNIA | SAN FRANCISCO | ISAAC L. REQUA. | Mines and speculation.
CALIFORNIA | SAN FRANCISCO | DR. WASHINGTON M. RYER. | Made in real-estate investments.
CALIFORNIA | SAN FRANCISCO | A. G. RUSS. | Made in merchandising and real estate.
CALIFORNIA | SAN FRANCISCO | GEORGE W. RIDLEY. | Extensive wheat farmer and land-owner in Butte County.
CALIFORNIA | SAN FRANCISCO | LOUIS SACHS. | Wholesale drygoods and clothing in Sachs Brothers & Co., here, and in Stiefel, Sachs & Co., New-York City.
CALIFORNIA | SAN FRANCISCO | CLAUS SPRECKELS. | Sugar refining.
CALIFORNIA | SAN FRANCISCO | JOHN D. SPRECKELS. | Received the gift of $1,000,000 from his father, Claus Spreckels, who by his fight with the Eastern Sugar Trust compelled the latter to buy his Philadelphia sugar refinery at an advance of $3,000,000 over what he paid for it.
CALIFORNIA | SAN FRANCISCO | MISS SPRECKELS. | Received a gift of $1,000,000, from her father, Claus Spreckels, who by his fight with the Eastern Sugar Trust compelled the latter to buy his Philadelphia sugar refinery at an advance of $3,000,000 over what he paid for it.
CALIFORNIA | SAN FRANCISCO | JOHN SKAE. | Silver mines and speculation. San Francisco and New-York City. Added to in real estate.
CALIFORNIA | SAN FRANCISCO | LEVI STRAUSS. | Merchandise drygoods and men’s furnishing goods in the firm of Levi Strauss & Co., of San Francisco.
CALIFORNIA | SAN FRANCISCO | GUSTAVE SUTRO. | Mines and real estate.
CALIFORNIA | SAN FRANCISCO | WILLIAM SHIELS. | Rise in real estate.
CALIFORNIA | SAN FRANCISCO | THOMAS SUNDERLAND. | Speculation in mining shares.
CALIFORNIA | SAN FRANCISCO | ADOLPH SUTRO. | Silver mines, speculation, the Sutro Tunnel and real estate.
CALIFORNIA | SAN FRANCISCO | A. M. SIMPSON. | Lumber manufacturing and lands.
CALIFORNIA | SAN FRANCISCO | LOUIS SLOSS. | Furs and merchandising in the Alaska Commercial Company.
CALIFORNIA | SAN FRANCISCO | LELAND STANFORD. | Made a large fortune in building and operating the Central Pacific Railroad; in the Wells, Fargo & Co. Express; in mines, and various investments. President of the Central Pacific and director in the Southern Pacific, Wells, Fargo & Co., etc.
CALIFORNIA | SAN FRANCISCO | FRED. W. SHARON. | Mines and real estate.
CALIFORNIA | SAN FRANCISCO | ROBERT SHERWOOD. | Jewelry business and speculation in Comstock shares.
CALIFORNIA | SAN FRANCISCO | MRS. J. D. TALLENT. | Banking, etc.
CALIFORNIA | SAN FRANCISCO | W. C. TALBOT (of Pope & Talbot). | Manufacturing, lumber, timber lands and vessels. The firm has sawmills and other large interests at Port Gamble, Wash.
CALIFORNIA | SAN FRANCISCO | HIRAM TUBBS. | Merchandising and lands.
CALIFORNIA | SAN FRANCISCO | R. R. THOMPSON. | Mines and real estate.
CALIFORNIA | SAN FRANCISCO | RICHARD TOBIN. | Law practice, banking and investments.
CALIFORNIA | SAN FRANCISCO | JAMES P. TREADWELL. | Law practice, large fees, loans, and city real estate.
CALIFORNIA | SAN FRANCISCO | WILLIAM H. TAYLOR. | Iron manufacturing. President of the Risdon Iron Works.
CALIFORNIA | SAN FRANCISCO | LLOYD TEVIS. | Made in the Wells, Fargo & Co. Express, Wells, Fargo & Co.’s Bank and branches; banking, real estate and mines. President of Wells, Fargo & Co.
CALIFORNIA | SAN FRANCISCO | N. VAN BERGEN (of N. Van Bergen & Co.). | Wholesale liquors and large investments in real estate.
CALIFORNIA | SAN FRANCISCO | MRS. J. H. VAN SCHROEDER. | Inherited. Gas stock, etc.
CALIFORNIA | SAN FRANCISCO | JOHN WIELAND (of the John Wieland Brewing Co.). | Brewing.
CALIFORNIA | SAN FRANCISCO | J. C. WILMERDING. | Wholesale liquors and real estate.
CALIFORNIA | SAN FRANCISCO | ANDREW WELCH. | Shipping and commission.
CALIFORNIA | SAN FRANCISCO | JOSEPH WOODWORTH. | Speculation in mining shares.
CALIFORNIA | SAN FRANCISCO | WILLIAM WAKERLEY. | City real estate.
CALIFORNIA | SAN FRANCISCO | R. B. WOODWARD. | Hotel and real estate.
CALIFORNIA | SAN FRANCISCO | WILLIAM H. WHITE. | Oils and real estate.
CALIFORNIA | SAN FRANCISCO | GENERAL THOMAS H. WILLIAMS. | Silver mines in Nevada.
CALIFORNIA | SAN FRANCISCO | EX-GOVERNOR R. H. WATERMAN. | Mines and railroads.
CALIFORNIA | SAN FRANCISCO | S. M. WILSON. | Law and investments.
CALIFORNIA | SAN FRANCISCO | MR. WHITTIER (of Whittier & Fuller). | Dealing in paints, oils and window glass.
CALIFORNIA | SAN JOSE | DANIEL T. MURPHY. | Formerly Mayor of San Jose. Made a fortune in ranche lands, cattle-raising and city real estate.
CALIFORNIA | WILLIAMS | JESSE C. STOVALL (of Stovall & Wilcoxson). | Dealing in cattle and sheep; loans, real estate and warehousing.
COLORADO | COLORADO SPRINGS | J. J. HAGERMAN. | Formerly one of the owners of the Chapin iron mine in Wisconsin. Increased his wealth by silver mines in Colorado, and railroad development. Director in the Aspen Mining and Smelting Company, Colorado Midland Railway, etc.
COLORADO | CREEDE | N. C. CREEDE. | Founder of the Creede Mining Camp, who is the owner of mines of great value.
COLORADO | DENVER | N. P. HILL. | Boston and Colorado Smelting Company. Smelting and mining.
COLORADO | DENVER | J. S. BROWN. | Cattle and wholesale groceries.
COLORADO | DENVER | W. M. CLAYTON. | Made in real estate.
COLORADO | DENVER | G. W. CLAYTON. | Local real estate.
COLORADO | DENVER | DONALD FLETCHER. | Real estate.
COLORADO | DENVER | H. A. W. TABOR. | Gold and silver mines.
COLORADO | DENVER | WILLIAM GILPIN. | Real estate, Spanish grant.
COLORADO | DENVER | JEROME B. CHAFFEE. | Mercantile business and banking, and finally in Colorado gold mines.
COLORADO | DENVER | ISAAC E. BLAKE. | Oil refining and real estate. He is connected with the Continental Oil Company, branch of the Standard Oil Company.
COLORADO | DENVER | MORITZ BARTH. | Made in real estate.
COLORADO | DENVER | DAVID H. MOFFAT, JR. | Banking, Colorado mines and railroads. President of the First National Bank, and of the Denver and Rio Grande Railroad.
COLORADO | DENVER | WILLIAM BARTH. | First in selling boots and shoes; then in real estate, in which his fortune has been chiefly made. President of the City National Bank.
COLORADO | DENVER | HENRY R. WOLCOTT. | Mines, telephone and street railway stock and real estate. Vice-President of the National Bank of Commerce. Director in the Equitable Life Assurance Society of New York. President of the Colorado Telephone Company, and director in many other corporations.
COLORADO | DENVER | WILLIAM B. DANIELS. | Merchandising. Founder of the leading drygoods and carpets house of the plains.
COLORADO | DENVER | DENNIS SULLIVAN. | Made in Colorado mines and cattle-raising.
COLORADO | DENVER | HENRY M. PORTER. | Cattle-raising, real estate and mines. He is the owner of a Mexican grant.
COLORADO | DENVER | S. N. WOOD. | Made in banking.
COLORADO | DENVER | F. P. ERNEST. | Cattle-raising and real estate.
COLORADO | DENVER | JOB A. COOPER. | Real estate and banking. President of the National Bank of Commerce.
COLORADO | DENVER | MR. ILIFF. | Made in cattle-raising and real estate.
COLORADO | DENVER | GEORGE C. SCHLEIER. | Made in real estate.
COLORADO | DENVER | F. A. KEENER. | Real estate and advance in values.
COLORADO | DENVER | J. R. GRANT (of the Omaha and Grant Smelting and Refining Company). | Mining first, and then smelting.
COLORADO | DENVER | E. ELLIDY (of the Omaha and Grant Smelting and Refining Company). | Colorado mines and smelting.
COLORADO | DENVER | WILLIAM S. JAMES (of the Omaha and Grant Smelting and Refining Company). | First in Colorado mines and then in smelting.
COLORADO | DENVER | CHARLES B. KOUNTZE. | Banking, real estate, railroads, Colorado mines and smelting. President of the Colorado National Bank, and interested in the Globe Smelting and Refining Company. A large owner of real estate.
COLORADO | DENVER | HENRY C. BROWN. | Made in real estate and investments. Obtained by pre-emption 160 acres now in the heart of the city. Owner of the Henry C. Brown Hotel, as well as of other valuable property.
COLORADO | DENVER | JOHN J. RIETHMANN. | Banking, real estate and Colorado mines. President of the German National Bank.
COLORADO | DENVER | WALTER S. CHEESMAN. | Partly in mines and banking, but mainly in real estate. Vice-President of the First National Bank.
