State | City | Name | Description
OHIO | SPRINGFIELD | PHINEAS P. MAST | Principally in manufacturing agricultural implements, but also in publishing, banking, etc. In the firms of P. P. Mast & Co., manufacturers, and Mast, Crowell & Kirkpatrick, publishers. Also president of the Springfield National Bank.
OHIO | TOLEDO | Mrs. VALENTINE H. KETCHAM | From her late husband, long the president of the First National Bank and a great owner of real estate.
OHIO | TOLEDO | DENNIS COUGHLIN | Brewing, real estate and banking. President of the Buckeye Brewing Company.
OHIO | TOLEDO | WILLIAM PETERS | He has made several millions in pine lands in Michigan, sawmills here, salt, real estate, and investment of his accumulations.
OHIO | TOLEDO | CHARLES L. REYNOLDS (of Reynolds Bros.) | With his brother he does the largest business in actual handling of grain in the world. They are grain and commission merchants.
OHIO | TOLEDO | SHELDON C. REYNOLDS | Made in grain and commission business and rebates from the Wabash road.
OHIO | TOLEDO | GEORGE H. KETCHAM | Inherited $750,000 from V. H. Ketcham, his father, and has added to it by investments in real estate, banking, stock farm, etc.
OHIO | TOLEDO | CALVIN BRONSON | Tobacco manufacturing in Toledo and Centreville and real estate in Chicago.
OHIO | TOLEDO | GEORGE W. DAVIS | Real estate and banking. President of Second National Bank.
OHIO | TOLEDO | JOHN B. KETCHAM, 2d | Inherited $750,000 from V. H. Ketcham. Real estate and banking. President of Ketcham’s National Bank.
OHIO | TOLEDO | MRS. MARY E. NEARING | Inherited from V. H. Ketcham. Made in real estate, banking, etc.
OHIO | TOLEDO | JOHN T. NEWTON | Real estate and banking.
OHIO | TOLEDO | HORACE S. WALBRIDGE | Started in the grain trade originally, but made his fortune principally in real estate. Has various interests.
OHIO | TOLEDO | SAMUEL M. YOUNG | Principal owner in the Toledo Gas Company. Made in gas works and real estate.
OHIO | WARREN | H. B. PERKINS | Iron manufacturing and rolling mills.
OHIO | WOOSTER | EDWARD QUINBY | Partly inherited. Real estate and loans.
OHIO | YOUNGSTOWN | CHAUNCEY H. ANDREWS (of C. H. & W. C. Andrews) | In the iron business, coal and railroads. President of Commercial National Bank.
OHIO | YOUNGSTOWN | CHARLES D. ARMS | Silver mines in Colorado.
OHIO | YOUNGSTOWN | WILLIAM T. CARRINGTON | Produce and railroads.
OREGON | ASTORIA | GEORGE FLAVEL | Real estate, steamboats and banking. President of the First National Bank.
OREGON | PORTLAND | HENRY D. GREEN | Gasworks, waterworks, real estate and kindred enterprises.
OREGON | PORTLAND | L. FLEISCHNER (of Fleischner, Mayer & Co.) | Dry-goods, millinery and fancy goods, and real estate.
OREGON | PORTLAND | C. H. LEWIS | Wharf property, storage business and merchandising.
OREGON | PORTLAND | W. S. LADD (of Ladd & Tilton, bankers) | Banking and purchases of real estate.
OREGON | PORTLAND | HENRY FAILING | Merchandising, banking and real estate. President of the First National Bank.
OREGON | PORTLAND | H. W. CORBETT (of Corbett, Failing & Co.) | Hardware merchandising, real estate and banking. President of the Security Savings and Trust Company.
OREGON | PORTLAND | FRANK DEKUM | Made in merchandising, banking and investments. President of the Portland Savings Bank.
OREGON | PORTLAND | JACOB KAMM | Made in merchandising and steamboating.
OREGON | PORTLAND | W. K. SMITH | Made in merchandising, steamboating and banking.
OREGON | PORTLAND | AMOS KING | Real estate investments.
OREGON | PORTLAND | DONALD McLEAY | Real estate and banking and merchandising. President of the United States National Bank.
OREGON | PORTLAND | H. S. PITTOCK | Real estate and newspaper publishing.
OREGON | PORTLAND | RICHARD WILLIAMS | Real estate and law practice.
OREGON | PORTLAND | LEWIS LOVE | Purchases of now-valuable real estate.
OREGON | PORTLAND | VAN B. DE LASHMUTT | Real estate, mining and banking. President of the Oregon National Bank and the Albina National Bank.
OREGON | PORTLAND | DAVID P. THOMPSON | Contracting, real estate and banking. President of the Commercial National Bank.
OREGON | SALEM | A. BUSH | Private banking and investments.
PENNSYLVANIA | ALLEGHENY CITY | COLONEL JAMES ANDREWS. | Engineer and general contractor on the Eads jetties and other public works.
PENNSYLVANIA | ALLEGHENY CITY | ALEXANDER M. BYERS. | Manufacturing iron pipe, in Westinghouse Electric and Manufacturing Company and in banking. President of the Iron City National Bank in Pittsburg.
PENNSYLVANIA | ALLEGHENY CITY | JOSEPH S. BROWN. | Manufacturing iron and steel. National Bank in Pittsburg.
PENNSYLVANIA | ALLEGHENY CITY | FELIX R. BRUNOT. | Inherited from his father, and made in manufacturing white and red lead.
PENNSYLVANIA | ALLEGHENY CITY | JOHN W. CHALFANT. | Manufacturing iron, steel and pipe. President of the People’s National Bank, in Pittsburg.
PENNSYLVANIA | ALLEGHENY CITY | JOHN DUNLAP. | Importing tin, metals and japanned goods.
PENNSYLVANIA | ALLEGHENY CITY | MRS. HERBERT DU PUY. | Inherited from her father, David Hostetter. Made in manufacturing proprietary medicines and bitters, and in railroad investments.
PENNSYLVANIA | ALLEGHENY CITY | MRS. ELIZABETH DARLINGTON. | Inherited from Jacob N. McCullough, vice-president of the Pennsylvania Company, who made nine millions in railroads and stock operations. His start was made in merchandising, groceries and banking.
PENNSYLVANIA | ALLEGHENY CITY | HARRY DARLINGTON, JR. | Inherited from Jacob N. McCullough, vice-president of the Pennsylvania Company, who made nine millions in railroads and stock operations. His start was made in merchandising groceries and banking.
PENNSYLVANIA | ALLEGHENY CITY | REBECCA DARLINGTON. | Inherited from Jacob N. McCullough, vice-president of the Pennsylvania Company, who made nine millions in railroads and stock operations. His start was made in merchandising, groceries and banking.
PENNSYLVANIA | ALLEGHENY CITY | DAVID GREGG. | Made in the sale of drygoods and investments in real estate.
PENNSYLVANIA | ALLEGHENY CITY | A. GUCKENHEIMER. | Distilling.
PENNSYLVANIA | ALLEGHENY CITY | ABRAHAM GARRISON. | Foundry and machine business and investments. President of Diamond National Bank and Safe Deposit Company of Pittsburg.
PENNSYLVANIA | ALLEGHENY CITY | MRS. J. COSH GRAHAM (born Annette McKee). | Inherited from her father, Thomas McKee. Made in real estate.
PENNSYLVANIA | ALLEGHENY CITY | JOSEPH HORNE. | Made in drygoods merchandising.
PENNSYLVANIA | ALLEGHENY CITY | MRS. DAVID HOSTETTER. | From David Hostetter. Made in proprietary medicines and bitters, real estate and railroad stocks.
PENNSYLVANIA | ALLEGHENY CITY | D. HERBERT HOSTETTER. | From David Hostetter. Made in proprietary medicines and bitters, real estate and railroad stocks. He is President of the Hostetter Company.
PENNSYLVANIA | ALLEGHENY CITY | THEODORE HOSTETTER. | From David Hostetter. Made in proprietary medicines and bitters, real estate and railroad stocks.
PENNSYLVANIA | ALLEGHENY CITY | ROBERT HAYS. | Made in steamboating on the rivers and canal transportation.
PENNSYLVANIA | ALLEGHENY CITY | THOMAS C. JENKINS. | Made in wholesale groceries and flour.
PENNSYLVANIA | ALLEGHENY CITY | BENJAMIN F. JONES (of Laughlin & Co.). | Made in iron and steel manufacturing.
PENNSYLVANIA | ALLEGHENY CITY | J. KAUFMAN. | Made in the sale of clothing.
PENNSYLVANIA | ALLEGHENY CITY | WILLIAM J. KOUNTZE. | Made in transportation by steamboats and rail.
PENNSYLVANIA | ALLEGHENY CITY | JACOB KLEE. | Manufacture and sale of clothing.
PENNSYLVANIA | ALLEGHENY CITY | JAMES LAUGHLIN, JR. (of Jones and Laughlin). | Manufacture of iron and steel.
PENNSYLVANIA | ALLEGHENY CITY | WILLIAM MULLINS. | Made in railroad interests.
PENNSYLVANIA | ALLEGHENY CITY | JAMES MCCUTCHEON. | Chiefly in iron manufacturing. President of the First National Bank.
PENNSYLVANIA | ALLEGHENY CITY | P. H. MILLER. | In the building of locomotives and steam engines.
PENNSYLVANIA | ALLEGHENY CITY | H. SELLER McKEE (of McKee & Brothers). | Manufacturing flint glass and traction roads. He is president of the First National Bank of Birmingham.
PENNSYLVANIA | ALLEGHENY CITY | MRS. JACOB N. McCULLOUGH. | From her husband, who was vice-president of the Pennsylvania Company. Made in railroads and stock operations. Originally in merchandising, groceries, and banking.
PENNSYLVANIA | ALLEGHENY CITY | JOHN PORTERFIELD. | Merchandising and groceries.
PENNSYLVANIA | ALLEGHENY CITY | HENRY PHIPPS, JR. | Made in iron and steel manufacturing and bridge building.
PENNSYLVANIA | ALLEGHENY CITY | MRS. JAMES PARK, JR. | Cotton, copper and steel manufacturing. Inherited.
PENNSYLVANIA | ALLEGHENY CITY | DAVID E. PARK. | Chiefly inherited. Cotton, copper and steel manufacturing.
PENNSYLVANIA | ALLEGHENY CITY | CHARLES PARK. | Chiefly inherited. Cotton, copper and steel manufacturing.
PENNSYLVANIA | ALLEGHENY CITY | WILLIAM G. PARK. | Chiefly inherited. Cotton, copper and steel manufacturing.
PENNSYLVANIA | ALLEGHENY CITY | JAMES PARK. | Chiefly inherited. Cotton, copper and steel manufacturing.
PENNSYLVANIA | ALLEGHENY CITY | A. E. W. PAINTER. | Made in iron manufacturing and investments. President of the Safe Deposit and Trust Company of Pittsburg.
PENNSYLVANIA | ALLEGHENY CITY | JACOB PAINTER. | Made in iron manufacturing.
PENNSYLVANIA | ALLEGHENY CITY | JOSHUA RHODES. | Iron pipe manufacturing.
PENNSYLVANIA | ALLEGHENY CITY | WILLIAM H. SINGER (of Singer, Nimick & Co.). | Steel manufacturing.
PENNSYLVANIA | ALLEGHENY CITY | MRS. DAVID A. STEWART. | From her husband, who was connected with the Pennsylvania Railroad Company, the Pittsburg Locomotive Works, and the Carnegie interests.
PENNSYLVANIA | ALLEGHENY CITY | JOHN WALKER. | Manufacturing soap, candles, etc.; cotton oil refining, and steel making.
PENNSYLVANIA | ALLEGHENY CITY | JOSEPH WALTON. | Coal merchant; fortune made largely during the war. He is president of the Farmers’ Deposit Bank, Pittsburg.
PENNSYLVANIA | BELLEFONTE | JAMES MILLIKEN. | Dealing in stocks, especially in that of the Western Union Telegraph Company. Has large holdings in that Company, and in the United States and National Express Companies, etc.
PENNSYLVANIA | BELLEFONTE | WILLIAM F. REYNOLDS. | Merchandising, real estate and banking. He engaged a long time ago in iron manufacturing and lost money therein, resolving never to invest another dollar in manufacturing. He has also had flour milling interests, but made no money therein. His wealth comes entirely from non-protected industries.
PENNSYLVANIA | BERWICK | MORDECAI W. JACKSON. | Partly in car-building. President of the First National Bank.
PENNSYLVANIA | BRADFORD | J. T. JONES. | Has made nearly a million, if not quite, in oil producing.
PENNSYLVANIA | BRADFORD | L. EMORY, JR. | Oil producing mainly, but has many other interests.
PENNSYLVANIA | BRADFORD | JAMES AMM. | Oil producing.
PENNSYLVANIA | CARLISLE | JAMES W. BOSLER. | Mainly in Indian contracts and the Palo Blanco cattle ranch, which was afterward sold to Stephen W. Dorsey.
PENNSYLVANIA | CHESTER | SAMUEL A. CROZER. | Has made a large fortune in cotton manufacturing at Upland, Penn.
PENNSYLVANIA | CHESTER | ROBERT WETHERILL. | Of R. Wetherill & Co.. Manufacture of steam engines and boilers. 
PENNSYLVANIA | CONNELLSVILLE | J. W. MOORE. | Made in coke manufacture.
PENNSYLVANIA | CORNWALL | ROBERT H. COLEMAN. | Has a sixth interest in the famous Cornwall iron ore hills, in which, the State Geologist reports, there are more than 30,000,000 tons of iron ore, above water level, and a larger amount below. The ore is worth about $2 a ton.
PENNSYLVANIA | CORNWALL | ANNIE COLEMAN. | A sixth interest in the Cornwall iron ore hills.
PENNSYLVANIA | CORNWALL | MRS. ALDER. | A sixteenth interest in the Cornwall iron ore banks.
PENNSYLVANIA | CURWENSVILLE | JOHN PATTON. | Lumbering, banking and increase in value of coal and timber lands.
PENNSYLVANIA | DANVILLE | THOMAS BEAVER. | Coal and iron and merchandising.
PENNSYLVANIA | DAWSON | W. J. RAINEY. | Coal mines, coke and banking.
PENNSYLVANIA | DUBOIS | JOHN E. DUBOIS. | Sawmills, lumber, tanning and leather, and other interests.
PENNSYLVANIA | EASTON | JOHN N. HUTCHINSON. | Made in railroads.
PENNSYLVANIA | ERIE | HON. WILLIAM A. GALBRAITH. | Mostly in Chicago real estate. President of Erie Dime Savings and Loan Company.
PENNSYLVANIA | ERIE | GEORGE SELDEN. | Chief proprietor of the largest boiler and engine shop in the world.
PENNSYLVANIA | ERIE | WILLIAM L. SCOTT, the richest man in the city. | Made in railroads, coal mines and real estate in the city and elsewhere. His fortune was more than ten millions.
PENNSYLVANIA | ERIE | MRS. WILLIAM L. SCOTT. | By inheritance from John F. Tracy, increased by investments in the Rock Island Railroad.
PENNSYLVANIA | ERIE | H. F. WATSON. | Made in the manufacture of building and roofing paper.
PENNSYLVANIA | ERIE | CHARLES M. REED. | Erie City real estate, inherited from C. M. Reed, his father.
PENNSYLVANIA | ERIE | MRS. GENERAL REED. | Erie City real estate, inherited from C. M. Reed.
PENNSYLVANIA | ERIE | JAMES CASEY. | Partly from his brother John, who was his partner, and made by both in railroad contracting and building.
PENNSYLVANIA | FOXBURG | JOSEPH M. FOX. | Inheritance of oil lands. Fortune made in oil producing and private banking. President of the Foxburg Bank.
PENNSYLVANIA | FOXBURG | HANNAH FOX. | Inheritance of oil lands.
PENNSYLVANIA | FRANKLIN | S. P. McCALMONT. | Law practice, coal interests, etc.
PENNSYLVANIA | HARRISBURG | J. DONALD CAMERON. | Partly inherited from Simon Cameron. Added to by investments in real estate and in iron manufacturing. He is president of the National Bank of Middletown.
PENNSYLVANIA | HARRISBURG | C. L. BAILEY. | Iron manufacturing.
PENNSYLVANIA | HARRISBURG | HENRY McCORMICK. | By inheritance from James McCormick, the richest man in this section of the State, who made a fortune in law practice and real estate speculation. Added to by the son in iron manufacturing.
PENNSYLVANIA | HARRISBURG | JAMES McCORMICK. | By inheritance from James McCormick, the richest man in this section of the State, who made a fortune in law practice and real estate speculation. Added to by the son in iron manufacturing.
PENNSYLVANIA | HARRISBURG | JACOB C. BOMBERGER | Banking.
PENNSYLVANIA | HAZLETON | GEO. H. MARKLE. | Made about $3,000,000 in coal mining and railroads, which he left to five sons and daughters.
PENNSYLVANIA | HAZLETON | CAPT. FRANK PARDEE. | From his father, Ario Pardee, who made a very large fortune, exceeding $10,000,000, in hard and soft coal mines, iron mines and lumber.
PENNSYLVANIA | KINGSTON | DANIEL EDWARDS. | Mines, store and other investments.
PENNSYLVANIA | LEWISBURG | WILLIAM CAMERON. | Land, banking, manufacturing and investments.
PENNSYLVANIA | LANCASTER | CHARLES B. GRUBB. | Inherited from Clement B. Grubb, who left $7,000,000. Made in iron furnaces and part ownership in the famous Cornwall iron ore hills. (See Cornwall.)
PENNSYLVANIA | LANCASTER | BERNARD J. McGRANN. | Made in railroad contracts private banking, etc.
PENNSYLVANIA | MIDDLETOWN | JAMES YOUNG. | Merchandising, lumber, coal, tobacco, etc., and investments.
PENNSYLVANIA | McKEESPORT | MR. KUHN (of Kuhn Bros.). | Banker and controller of the American Water Works and Guarantee Company. They control thirty or forty plants.
PENNSYLVANIA | MAUCH CHUNK | GENERAL WILLIAM LILLY. | Coal mining.
PENNSYLVANIA | MAUCH CHUNK | EDWARD B. LEISENRING. | Coal mining.
PENNSYLVANIA | MAUCH CHUNK | MRS. CHARLES H. CUMMINGS. | The only daughter of the late Judge Asa Packer, from whom she inherited a fortune, made in railroads, specially the Lehigh Valley Railroad.
PENNSYLVANIA | OIL CITY | M. GEARY (of D. O’Day & M. Geary Oil City Boiler Works). | Boiler manufacturing.
PENNSYLVANIA | OIL CITY | MR. VANDERGRIFT (of Vandergrift, Young & Co.). | Oil producing.
PENNSYLVANIA | OIL CITY | WESLEY CHAMBERS. | Oil property and mining speculation.
PENNSYLVANIA | CITY OF PHILADELPHIA | MRS. J. C. AUDENRIED. | Inherited.
PENNSYLVANIA | CITY OF PHILADELPHIA | J. B. ALTEMUS (Coffin, Altemus & Co.). | Commission dry goods.
PENNSYLVANIA | CITY OF PHILADELPHIA | WILLIAM C. ALLISON. | Car building, mainly.
PENNSYLVANIA | CITY OF PHILADELPHIA | C. W. BERGNER (of the Bergner & Engel Brewing Co.). | Brewing and real estate.
PENNSYLVANIA | CITY OF PHILADELPHIA | JOHN BOHLEN. | Brewing and real estate.
PENNSYLVANIA | CITY OF PHILADELPHIA | SAMUEL BAUGH. | Tanning and leather and railways. In the firm of Prichett, Baugh & Co.
PENNSYLVANIA | CITY OF PHILADELPHIA | JOHN F. BETZ. | Brewing and investments. A very rich man.
PENNSYLVANIA | CITY OF PHILADELPHIA | T. WISTAR BROWN (of John Farnum & Co.). | Manufacturing dry goods. Treasurer of Morris, Tasker & Co., manufacturers of iron pipes, tubes, etc. President of the Provident Life and Trust Company.
PENNSYLVANIA | CITY OF PHILADELPHIA | ALEXANDER BIDDLE. | Inherited. Made in the Pennsylvania Railroad, banking, and investments.
PENNSYLVANIA | CITY OF PHILADELPHIA | JOHN T. BAILEY (of John T. Bailey & Co.). | Made in the manufacture of ropes, bags and twine.
PENNSYLVANIA | CITY OF PHILADELPHIA | CHARLES BAEDER (of Baeder, Adamson & Co.). | Manufacture of glue, curled hair, sand paper, etc.; and investments.
PENNSYLVANIA | CITY OF PHILADELPHIA | CONYERS BUTTON. | Inherited. Made in the manufacture of knit goods and hosiery.
PENNSYLVANIA | CITY OF PHILADELPHIA | ALEXANDER BROWN. | Banking and investments. In the firm Brown Bros., having branches in New York, Philadelphia, and Baltimore.
PENNSYLVANIA | CITY OF PHILADELPHIA | EDWIN N. BENSON (of Benson & Townsend). | Private banking, stocks and investments.
PENNSYLVANIA | CITY OF PHILADELPHIA | MRS. ALFRED G. BAKER. | From her father, George Fales. Made in dry goods commission business and insurance.
PENNSYLVANIA | CITY OF PHILADELPHIA | CHARLES F. BERWIND. | Coal mines and railroads.
PENNSYLVANIA | CITY OF PHILADELPHIA | MRS. JULIA BRADFORD. | From her husband, first president of the Philadelphia and Reading Railroad. She is the owner of a large fortune.
PENNSYLVANIA | CITY OF PHILADELPHIA | MRS. MATTHEW BAIRD. | From her husband, a locomotive builder.
PENNSYLVANIA | CITY OF PHILADELPHIA | WILLIAM S. BOYD. | Made a fortune in the grocery business.
PENNSYLVANIA | CITY OF PHILADELPHIA | JOHN H. BROMLEY (of John Bromley & Sons, carpet manufacturers, and the Bromley Manufacturing Company, upholstery goods). | Has made a fortune in manufacturing.
PENNSYLVANIA | CITY OF PHILADELPHIA | JOSEPH H. BROMLEY. | Manufacturing curtains and carpets in John Bromley & Sons and the Bromley Manufacturing Company.
PENNSYLVANIA | CITY OF PHILADELPHIA | BARONESS VON BILDT (Sweden). | From her father, J. Bloomfield Moore. Made in manufacturing.
PENNSYLVANIA | CITY OF PHILADELPHIA | LOUIS BERGDOLL (of the Louis Bergdoll Brewing Company). | Brewing and real estate.
PENNSYLVANIA | CITY OF PHILADELPHIA | DANIEL BAUGH. | Originally in tanning and leather; then in the manufacture of animal charcoal for sugar refining and kindred products, chemicals and glue.
PENNSYLVANIA | CITY OF PHILADELPHIA | HENRY BOTTOMLEY. | Made in the manufacture of woollen goods.
PENNSYLVANIA | CITY OF PHILADELPHIA | WILLIAM B. BEMENT. | Made a fortune of $1,300,000 in tool manufacturing and foundry business. While he has reduced his fortune largely by gifts to his children, he should probably be mentioned here.
PENNSYLVANIA | CITY OF PHILADELPHIA | COL. JOSEPH M. BENNETT. | Before and during the war, engaged in the wholesale clothing business. He founded the clothing store known as Tower Hall, now owned by another firm. He is the owner of Chestnut Street Opera House and other valuable real estate.
PENNSYLVANIA | CITY OF PHILADELPHIA | GEORGE W. BLABON. | Manufacturing oil cloths.
PENNSYLVANIA | CITY OF PHILADELPHIA | GEORGE BURNHAM (of Burnham, Williams & Co.). | Locomotive building.
PENNSYLVANIA | CITY OF PHILADELPHIA | MRS. ARTHUR BROCK. | From her father, G. Dawson Coleman. Has a part ownership in the famous Cornwall iron-ore hills. (See Cornwall, Penn.)
PENNSYLVANIA | CITY OF PHILADELPHIA | MRS. HORACE BROCK. | From her father, G. Dawson Coleman. Has a part ownership in the famous Cornwall iron-ore hills. (See Cornwall, Penn.)
PENNSYLVANIA | CITY OF PHILADELPHIA | JOHN BAIRD. | Marble business and investments.
PENNSYLVANIA | CITY OF PHILADELPHIA | JOHN A. BROWN, JR. | Private banking and investments.
PENNSYLVANIA | CITY OF PHILADELPHIA | WILLIAM BUCKNELL. | Originally a wood carver and worked with his apron until worth $50,000. Then built gas works under contract in various parts of the country and took part payment in the stock, which rose rapidly in value. Then in brokerage business in Philadelphia, and dealt in securities and made large purchases of unimproved real estate, which afterward became valuable.
PENNSYLVANIA | CITY OF PHILADELPHIA | A. J. CASSATT. | Made in railroads and the Westinghouse brake. President of the New-York, Philadelphia and Norfolk R. R.
PENNSYLVANIA | CITY OF PHILADELPHIA | WILLIAM CRAMP (of William Cramp & Sons). | Partly inherited. Made originally in building wooden vessels. Then in building and repairing iron steamships and war vessels, in which the firm have a very large business and a great reputation. Their plant is worth many millions.
PENNSYLVANIA | CITY OF PHILADELPHIA | CHARLES H. CRAMP (of William Cramp & Sons). | Partially inherited. Made originally in building wooden vessels, then in building and repairing iron steamships and war vessels, in which the firm have a very large business and a great reputation. Their plant is worth many millions.
PENNSYLVANIA | CITY OF PHILADELPHIA | JAY COOKE. | Banking, negotiation of Government bonds during the war; railroad enterprises, and various investments, including silver mines.
PENNSYLVANIA | CITY OF PHILADELPHIA | HARRISON K. CANER. | Inherited.
PENNSYLVANIA | CITY OF PHILADELPHIA | WILLIAM T. CARTER. | Coal mining; iron furnace at Redington, Penn., and investments.
PENNSYLVANIA | CITY OF PHILADELPHIA | MRS. G. DAWSON COLEMAN. | From her husband. Has an interest in the famous iron ore hills at Cornwall, Penn. (See Cornwall.)
PENNSYLVANIA | CITY OF PHILADELPHIA | B. DAWSON COLEMAN. | Inherited from G. Dawson Coleman an interest in the Cornwall iron-ore hills large enough to make him a millionaire. (See Cornwall, Penn.)
PENNSYLVANIA | CITY OF PHILADELPHIA | EDWARD COLEMAN. | Inherited from G. Dawson Coleman an interest in the Cornwall iron-ore hills large enough to make him a millionaire. (See Cornwall, Penn.)
PENNSYLVANIA | CITY OF PHILADELPHIA | Miss FANNIE COLEMAN. | Inherited from G. Dawson Coleman an interest in the Cornwall iron-ore hills large enough to make her a millionaire. (See Cornwall, Penn.)
PENNSYLVANIA | CITY OF PHILADELPHIA | Miss ANNIE COLEMAN. | Inherited from G. Dawson Coleman an interest in the Cornwall iron-ore hills large enough to make her a millionaire. (See Cornwall, Penn.)
PENNSYLVANIA | CITY OF PHILADELPHIA | ROBERT COLEMAN (now living in Paris). | He has a sixth interest in the Cornwall iron-ore hills. (See Cornwall, Penn.)
PENNSYLVANIA | CITY OF PHILADELPHIA | SAMUEL F. CORLIES. | Partly inherited and increased by judicious investments.
PENNSYLVANIA | CITY OF PHILADELPHIA | GEORGE CAMPBELL. | Manufacturing yarns.
PENNSYLVANIA | CITY OF PHILADELPHIA | THEODORE C. CAREY (of Carey Bros.). | Made in the manufacture of wall paper and stationery.
PENNSYLVANIA | CITY OF PHILADELPHIA | G. M. COATES (of Coates Bros., merchants, and Porter & Coates, booksellers). | Commission wool and bookselling.
PENNSYLVANIA | CITY OF PHILADELPHIA | LEMUEL COFFIN. | (of Coffin, Altemus & Co.). Made in commission drygoods.
PENNSYLVANIA | CITY OF PHILADELPHIA | WILLIAM M. COATES (of Coates Bros.). | Commission wool.
PENNSYLVANIA | CITY OF PHILADELPHIA | ECKLEY B. COXE. | One of the wealthiest citizens of Philadelphia. Partner in Coxe Bros. & Co., owners of coal lands at Hazleton, mining plant, etc. He is in railroads and many other enterprises.
PENNSYLVANIA | CITY OF PHILADELPHIA | ALEXANDER B. COXE (of Coxe Bros. & Co.). | Coal mines at Hazleton, Penn.
PENNSYLVANIA | CITY OF PHILADELPHIA | BRINTON COXE (of Coxe Bros. & Co.). | Coal mines at Hazleton, Penn.
PENNSYLVANIA | CITY OF PHILADELPHIA | Miss COXE (of Coxe Bros. & Co.). | Coal mines at Hazleton, Penn.
PENNSYLVANIA | CITY OF PHILADELPHIA | GEORGE W. CHILDS. | Publication of “The Public Ledger,” from which he derives a very large income.
PENNSYLVANIA | CITY OF PHILADELPHIA | CALEB COPE. | Vessel-owning, freighting and investments.
PENNSYLVANIA | CITY OF PHILADELPHIA | JAMES C. COOPER. | Show and circus business.
PENNSYLVANIA | CITY OF PHILADELPHIA | JOHN H. CONVERSE (of Burnham, Williams & Co.). | Locomotive building.
PENNSYLVANIA | CITY OF PHILADELPHIA | CHARLES I. CRAIG. | Manufacturing soap.
PENNSYLVANIA | CITY OF PHILADELPHIA | ISAAC H. CLOTHIER (of Strawbridge & Clothier). | Wholly in wholesale and retail drygoods.
PENNSYLVANIA | CITY OF PHILADELPHIA | COFFIN COLKETT. | Made in local city passenger roads.
PENNSYLVANIA | CITY OF PHILADELPHIA | HUGH CRAIG. | Made in the wholesale liquor and merchandise brokerage business. His warehouse was the first freight depot of the Pennsylvania Railroad in Philadelphia.
PENNSYLVANIA | CITY OF PHILADELPHIA | CLARENCE H. CLARKE. | Banking and brokerage business. Formerly in the firm of E. H. Clarke & Co., bankers.
PENNSYLVANIA | CITY OF PHILADELPHIA | RICHARD J. DOBBINS. | Building and real estate. The owner of nearly 300 houses.
PENNSYLVANIA | CITY OF PHILADELPHIA | ANTHONY J. DREXEL. | Banking, in the firm of Drexel, Morgan & Co., New-York City, and Drexel & Co., Philadelphia. Has large investments and is a very large owner in the Pennsylvania Railroad.
PENNSYLVANIA | CITY OF PHILADELPHIA | ANTHONY J. DREXEL, JR. | Largely by inheritance. Made in banking with the Drexels.
